date,debit_inn,credit_inn,amount,purpose,txn_risk_score,txn_anomaly_flag
2019-01-09,d877722ca4e40f98,8d9e0be733f77f1c,10.0,комиссия внутри сбербанка за пп/пт через дбо согласно договору рко № acc_ded93f97f389 от '02/12/2014'. №1 (3000000 rur ) от 09/01/19. без ндс,0.9999980058502028,1
2021-05-20,8d9e0be733f77f1c,d877722ca4e40f98,160000.0,"<si>прием ден. нал. через ус 60007270 date_8004a826e60a 00:08:27 вноситель аман вадим владимирович(170091651) 14, займы займ от учеридителя хо сон дя",0.9999980058502028,1
2021-05-19,41face6c4b94dd88,d877722ca4e40f98,6336.0,оплата по счету № 3 от 17.05.2021г. штраф сумма 6336-00 без налога (ндс),0.9999980058502028,1
2021-05-20,d877722ca4e40f98,8d9e0be733f77f1c,31.58,"комиссия за перечисление средств со сч. юл на сч.фл (в т.ч. при закрытии счета), (оборот до 150 тыс. руб) по дог. рко №acc_ded93f97f389 от '02/12/2014'. за документы: документ(ы):; от 20/05/21 №№: 155 (210",0.9999980058502028,1
2021-05-20,d877722ca4e40f98,8d9e0be733f77f1c,37.0,"комиссия в другие банки (кредитные организации, банк россии) за пп/пт через дбо согласно договору рко №acc_ded93f97f389 от '02/12/2014'. документы: №154 (160000 rur ) от 20/05/21 без ндс",0.9999980058502028,1
2021-05-20,d877722ca4e40f98,8d9e0be733f77f1c,480.0,комиссия за прием наличных денежных средств через банкомат. документ(ы): №32 (160000 rur ) от 20/05/21. без ндс,0.9999980058502028,1
2021-05-20,d877722ca4e40f98,035fab081fc0922f,2105.28,заработная плата за первую половину мая 21 г для зачисления на счет ермошкина михаила юрьевича сумма 2105-28 без налога (ндс),0.9999980058502028,1
2021-05-20,d877722ca4e40f98,6290b8d67943ece5,4210.56,заработная плата за первую половину мая 21г для зачисления на счет таранова константина анатольевича сумма 4210-56 без налога (ндс),0.9999980058502028,1
2021-05-20,d877722ca4e40f98,8d9e0be733f77f1c,19473.48,аванс по заработной плате по реестру №11 от date_8004a826e60a в соответствии с договором 50356798 от date_eb8c294d74c6,0.9999980058502028,1
2021-05-20,d877722ca4e40f98,1d83fd5f5fefc19f,160000.0,оплата по договору № 3510 от date_f300508e7393 теплоэнергия по с/ф тэ000001385 от 31.01.21г сумма 160000-00 в т.ч. ндс (20%) 26666-67,0.9999980058502028,1
2021-05-21,d877722ca4e40f98,8d9e0be733f77f1c,37.0,"комиссия в другие банки (кредитные организации, банк россии) за пп/пт через дбо согласно договору рко №acc_ded93f97f389 от '02/12/2014'. документы: №157 (2329840.38 rur ) от 21/05/21 без ндс",0.9999980058502028,1
2019-01-09,d877722ca4e40f98,6931e23e98703aa9,3000000.0,оплата по счету № 28 от date_9f241b636025 по договору №3-тор от 19.05.18г аванс сумма 3000000-00 в т.ч. ндс (18%) 457627-12,0.9999980058502028,1
2021-05-21,d877722ca4e40f98,8d9e0be733f77f1c,54.6,оплата комиссии за оказание услуг по зачислению денежных средств. за период с date_f5e8ddb0295d по date_8004a826e60a. договор от date_eb8c294d74c6 № 50356798. ндс не облагается.,0.9999980058502028,1
2021-05-21,d877722ca4e40f98,b7f7935acecc2c89,2329840.38,выкуп земельного участка с кадастровым номером 65:01:0601006:1781 по договор_aa2bdccd4f22 купли -продажи земельного участка,0.9999980058502028,1
2021-05-21,5ae9eeb0d29bc5c0,d877722ca4e40f98,2350000.0,перевод денежных средств по договору № пи-1/281220 от date_8425413630fa г. сумма 2350000-00 без налога (ндс),0.9999980058502028,1
2021-05-24,d877722ca4e40f98,8d9e0be733f77f1c,37.0,"комиссия в другие банки (кредитные организации, банк россии) за пп/пт через дбо согласно договору рко №acc_ded93f97f389 от '02/12/2014'. документы: №158 (3000 rur ) от 24/05/21 без ндс",0.9999980058502028,1
2021-05-24,d877722ca4e40f98,8d9e0be733f77f1c,383.59,пособие по временной нетрудоспособности (больничные) по реестру №12 от date_70f27e0075c0 в соответствии с договором 50356798 от date_eb8c294d74c6,0.9999980058502028,1
2021-05-24,d877722ca4e40f98,ac31ae518119510a,3000.0,оплата по счету № 61248 от 24.05.21г за май 21г сумма 3000-00 без налога (ндс),0.9999980058502028,1
2021-05-25,d877722ca4e40f98,7b6d655993f0d2ed,22000.0,госпошлина за государственную регистрацию прав,0.9999980058502028,1
2021-05-31,d877722ca4e40f98,8d9e0be733f77f1c,0.77,оплата комиссии за оказание услуг по зачислению денежных средств. за период с date_a60f22934e30 по date_9f87cfd44091. договор от date_eb8c294d74c6 № 50356798. ндс не облагается.,0.9999980058502028,1
2021-05-18,8d9e0be733f77f1c,d877722ca4e40f98,155000.0,"<si>прием ден. нал. через ус 60036386 date_b5af54dbd25c 00:38:54 вноситель аман вадим владимирович(170091651) 14, займы займ от учеридителя хо сон дя",0.9999980058502028,1
2021-05-18,d877722ca4e40f98,41face6c4b94dd88,316800.0,оплата по счету № 177 от 30.04.21г услуги физ.охраны за апрель 21г сумма 316800-00 без налога (ндс),0.9999980058502028,1
2021-05-18,d877722ca4e40f98,8d9e0be733f77f1c,465.0,комиссия за прием наличных денежных средств через банкомат. документ(ы): №31 (155000 rur ) от 18/05/21. без ндс,0.9999980058502028,1
2021-05-18,d877722ca4e40f98,8d9e0be733f77f1c,8.0,комиссия внутри сбербанка за пп/пт через дбо согласно договору рко № acc_ded93f97f389 от '02/12/2014'. №153 (316800 rur ) от 18/05/21. без ндс,0.9999980058502028,1
2021-05-11,d877722ca4e40f98,8d9e0be733f77f1c,7437.43,отпускные по реестру №9 от date_f5e8ddb0295d в соответствии с договором 50356798 от date_eb8c294d74c6,0.9999980058502028,1
2021-05-11,d877722ca4e40f98,40149916b115417d,15612.94,оплата по договору № 1086 по inn_d3b9c645e361 от 30.04.21г сумма 15612-94 в т.ч. ндс (20%) 2602-16,0.9999980058502028,1
2021-05-11,d877722ca4e40f98,eed8b1f54ed4366c,20790.0,оплата по договору электроэнергия по дог.№112458 от 03.03.17 аванс 70% за май 2021г по с/ф 18862-080-02 от 30.045.21г сумма 20790-00 в т.ч. ндс (20%) 3465-00,0.9999980058502028,1
2021-05-11,d877722ca4e40f98,1d83fd5f5fefc19f,99401.87,оплата по договору № 3510 от date_f300508e7393 теплоэнергия по с/ф тэ000007164 от 30.04.21 г за апрель 21г сумма 99401-87 в т.ч. ндс (20%) 16566-98,0.9999980058502028,1
2021-05-11,7ad54077510c09e4,d877722ca4e40f98,200000.0,оплата по договору займа №2-си/260121 сумма 200000-00 без налога (ндс),0.9999980058502028,1
2021-05-12,d877722ca4e40f98,8d9e0be733f77f1c,8.0,комиссия внутри сбербанка за пп/пт через дбо согласно договору рко № acc_ded93f97f389 от '02/12/2014'. №151 (1000000 rur ) от 12/05/21. без ндс,0.9999980058502028,1
2021-05-12,d877722ca4e40f98,8d9e0be733f77f1c,30.0,комиссия за прием наличных денежных средств через банкомат. документ(ы): №29 (10000 rur ) от 12/05/21. без ндс,0.9999980058502028,1
2021-05-12,d877722ca4e40f98,8d9e0be733f77f1c,1440.0,комиссия за прием наличных денежных средств через банкомат. документ(ы): №27 (480000 rur ) от 12/05/21. без ндс,0.9999980058502028,1
2021-05-12,d877722ca4e40f98,8d9e0be733f77f1c,1530.0,комиссия за прием наличных денежных средств через банкомат. документ(ы): №28 (510000 rur ) от 12/05/21. без ндс,0.9999980058502028,1
2021-05-12,d877722ca4e40f98,032f0b4d2498f263,1000000.0,частичный возврат займа по договору №1 от date_1621fe873e05 сумма 1000000-00 без налога (ндс),0.9999980058502028,1
2021-05-12,8d9e0be733f77f1c,d877722ca4e40f98,10000.0,"<si>прием ден. нал. через ус 077008 date_c37779dfbcb4 09:02:39 вноситель аман вадим владимирович(170091651) 14, займы займ от учеридителя хо сон дя",0.9999980058502028,1
2021-05-12,8d9e0be733f77f1c,d877722ca4e40f98,480000.0,"<si>прием ден. нал. через ус 60007270 date_c37779dfbcb4 08:51:52 вноситель аман вадим владимирович(170091651) 14, займы займ от учеридителя хо сон дя",0.9999980058502028,1
2021-05-12,8d9e0be733f77f1c,d877722ca4e40f98,510000.0,"<si>прием ден. нал. через ус 60007270 date_c37779dfbcb4 09:01:40 вноситель аман вадим владимирович(170091651) 14, займы займ от учеридителя хо сон дя",0.9999980058502028,1
2021-05-13,d877722ca4e40f98,80799e1a6646b6dc,58.0,"налог на доходы физических лиц за апрель 2021 года ,больничный",0.9999980058502028,1
2021-05-13,d877722ca4e40f98,8d9e0be733f77f1c,389.72,пособие по временной нетрудоспособности (больничные) по реестру №10 от date_4a9a6fb2b732 в соответствии с договором 50356798 от date_eb8c294d74c6,0.9999980058502028,1
2021-05-17,d877722ca4e40f98,8d9e0be733f77f1c,435.0,комиссия за прием наличных денежных средств через банкомат. документ(ы): №30 (145000 rur ) от 17/05/21. без ндс,0.9999980058502028,1
2021-05-17,8d9e0be733f77f1c,d877722ca4e40f98,145000.0,"<si>прием ден. нал. через ус 60007270 date_1f7d421a4ce2 09:22:48 вноситель аман вадим владимирович(170091651) 14, займы займ от учеридителя хо сон дя",0.9999980058502028,1
2021-05-31,d877722ca4e40f98,8d9e0be733f77f1c,8.0,комиссия внутри сбербанка за пп/пт через дбо согласно договору рко № acc_ded93f97f389 от '02/12/2014'. №161 (72054.79 rur ) от 31/05/21. без ндс,0.9999980058502028,1
2021-05-31,d877722ca4e40f98,80799e1a6646b6dc,58.0,налог на доходы физических лиц за май 2021 года,0.9999980058502028,1
2021-05-31,d877722ca4e40f98,8d9e0be733f77f1c,210.0,комиссия за прием наличных денежных средств через банкомат. документ(ы): №33 (70000 rur ) от 31/05/21. без ндс,0.9999980058502028,1
2021-06-08,d877722ca4e40f98,8d9e0be733f77f1c,74.0,"комиссия в другие банки (кредитные организации, банк россии) за пп/пт через дбо согласно договору рко №acc_ded93f97f389 от '02/12/2014'. документы: документ(ы):; от 08/06/21 №№: 172 (9909.59 rur ), 170 (6",0.9999980058502028,1
2021-06-08,d877722ca4e40f98,40149916b115417d,9909.59,оплата по договору № 1086 по inn_28d21f947336 от 31.05.21г сумма 9909-59 в т.ч. ндс (20%) 1651-60,0.9999980058502028,1
2021-06-08,d877722ca4e40f98,eed8b1f54ed4366c,15660.0,оплата по договору электроэнергия по дог.№112458 от 03.03.17 аванс 70% за июнь 2021г по с/ф 27540-080-02 от 31.05.21г сумма 15660-00 в т.ч. ндс (20%) 2610-00,0.9999980058502028,1
2021-06-08,d877722ca4e40f98,1d83fd5f5fefc19f,68974.92,оплата по договору № 3510 от date_f300508e7393 теплоэнергия по с/ф тэ000009092 от 31.05.21 г за май 21г сумма 68974-92 в т.ч. ндс (20%) 11495-82,0.9999980058502028,1
2021-06-08,8d9e0be733f77f1c,d877722ca4e40f98,200000.0,"<si>прием ден. нал. через ус 60035903 date_cf4cc686402d 09:24:57 вноситель аман вадим владимирович(170091651) 14, займы займ от учеридителя хо сон дя",0.9999980058502028,1
2021-06-09,d877722ca4e40f98,8d9e0be733f77f1c,855.0,комиссия за прием наличных денежных средств через банкомат. документ(ы): №37 (285000 rur ) от 09/06/21. без ндс,0.9999980058502028,1
2021-06-09,8d9e0be733f77f1c,d877722ca4e40f98,285000.0,"<si>прием ден. нал. через ус 60035903 date_82a336c4ee77 07:24:25 вноситель аман вадим владимирович(170091651) 14, займы займ от учеридителя хо сон дя",0.9999980058502028,1
2021-06-10,d877722ca4e40f98,8d9e0be733f77f1c,16.0,"комиссия внутри сбербанка за пп/пт через дбо согласно договору рко № acc_ded93f97f389 от '02/12/2014'. документ(ы):; от 10/06/21 №№: 174 (327360 rur ), 177 (500000 rur ). без ндс",0.9999980058502028,1
2021-06-10,d877722ca4e40f98,8d9e0be733f77f1c,37.0,"комиссия в другие банки (кредитные организации, банк россии) за пп/пт через дбо согласно договору рко №acc_ded93f97f389 от '02/12/2014'. документы: №176 (33000 rur ) от 10/06/21 без ндс",0.9999980058502028,1
2021-06-10,d877722ca4e40f98,8d9e0be733f77f1c,1050.0,комиссия за прием наличных денежных средств через банкомат. документ(ы): №38 (350000 rur ) от 10/06/21. без ндс,0.9999980058502028,1
2021-06-10,d877722ca4e40f98,1dee298b3b4c3881,33000.0,оплата по договору №011/21/а от date_b5af54dbd25c за аудиторские услуги по счету № 040 от 18.05.21 сумма 33000-00 без налога (ндс),0.9999980058502028,1
2021-06-10,d877722ca4e40f98,41face6c4b94dd88,327360.0,оплата по счету № 213 от 31.05.21г услуги физ.охраны за май 21г сумма 327360-00 без налога (ндс),0.9999980058502028,1
2021-06-10,d877722ca4e40f98,032f0b4d2498f263,500000.0,частичный возврат займа по договору №1 от date_1621fe873e05 сумма 500000-00 без налога (ндс),0.9999980058502028,1
2021-06-10,8d9e0be733f77f1c,d877722ca4e40f98,350000.0,"<si>прием ден. нал. через ус 60026438 date_2640da955a27 03:23:03 вноситель аман вадим владимирович(170091651) 14, займы займ от учеридителя хо сон дя",0.9999980058502028,1
2021-06-11,d877722ca4e40f98,8d9e0be733f77f1c,76.53,оплата комиссии за оказание услуг по зачислению денежных средств. за период с date_fff37672e388 по date_2640da955a27. договор от date_eb8c294d74c6 № 50356798. ндс не облагается.,0.9999980058502028,1
2021-06-11,d877722ca4e40f98,8d9e0be733f77f1c,450.0,комиссия за прием наличных денежных средств через банкомат. документ(ы): №39 (150000 rur ) от 10/06/21. без ндс,0.9999980058502028,1
2021-06-11,8d9e0be733f77f1c,d877722ca4e40f98,150000.0,"<si>прием ден. нал. через ус 60025289 date_2640da955a27 23:23:50 вноситель аман вадим владимирович(170091651) 14, займы займ от учеридителя хо сон дя",0.9999980058502028,1
2021-06-12,d877722ca4e40f98,8d9e0be733f77f1c,450.0,комиссия за прием наличных денежных средств через банкомат. документ(ы): №40 (150000 rur ) от 12/06/21. без ндс,0.9999980058502028,1
2021-06-08,d877722ca4e40f98,8d9e0be733f77f1c,600.0,комиссия за прием наличных денежных средств через банкомат. документ(ы): №36 (200000 rur ) от 08/06/21. без ндс,0.9999980058502028,1
2021-06-08,d877722ca4e40f98,8d9e0be733f77f1c,8.0,комиссия внутри сбербанка за пп/пт через дбо согласно договору рко № acc_ded93f97f389 от '02/12/2014'. №171 (15660 rur ) от 08/06/21. без ндс,0.9999980058502028,1
2021-05-31,d877722ca4e40f98,032f0b4d2498f263,72054.79,оплата процентов по договору процентного денежного займа №1 от 17.12.20г сумма 72054-79 без налога (ндс),0.9999980058502028,1
2021-06-07,8d9e0be733f77f1c,d877722ca4e40f98,150000.0,"<si>прием ден. нал. через ус 60036385 date_e137a3484f95 05:23:22 вноситель аман вадим владимирович(170091651) 14, займы займ от учеридителя хо сон дя",0.9999980058502028,1
2021-05-31,8d9e0be733f77f1c,d877722ca4e40f98,70000.0,"<si>прием ден. нал. через ус 60007270 date_fff37672e388 08:46:15 вноситель аман вадим владимирович(170091651) 14, займы займ от учеридителя хо сон дя",0.9999980058502028,1
2021-06-01,d877722ca4e40f98,8d9e0be733f77f1c,1800.0,комиссия за ведение счета 'acc_ded93f97f389' от '02/12/2014' за период с '01/05/2021' по '31/05/2021' за 31 дней. ндс не облагается,0.9999980058502028,1
2021-06-03,d877722ca4e40f98,8d9e0be733f77f1c,199.0,информирование об операциях поступления и/или списания по банковскому(им) счету(ам) в рублях рф за период с '01/05/2021' по '31/05/2021'.,0.9999980058502028,1
2021-06-04,d877722ca4e40f98,8d9e0be733f77f1c,37.0,"комиссия в другие банки (кредитные организации, банк россии) за пп/пт через дбо согласно договору рко №acc_ded93f97f389 от '02/12/2014'. документы: №169 (4999.97 rur ) от 04/06/21 без ндс",0.9999980058502028,1
2021-06-04,d877722ca4e40f98,8d9e0be733f77f1c,43.42,"комиссия за перечисление средств со сч. юл на сч.фл (в т.ч. при закрытии счета), (оборот до 150 тыс. руб) по дог. рко №acc_ded93f97f389 от '02/12/2014'. за документы: документ(ы):; от 04/06/21 №№: 168 (578",0.9999980058502028,1
2021-06-04,d877722ca4e40f98,8d9e0be733f77f1c,300.0,комиссия за прием наличных денежных средств через банкомат. документ(ы): №34 (100000 rur ) от 04/06/21. без ндс,0.9999980058502028,1
2021-06-04,d877722ca4e40f98,ca3891c167141f4d,670.16,взносы на обязательное страхование от несчастных случаев. регистрационный номер в фсс inn_f24b52802750,0.9999980058502028,1
2021-06-04,d877722ca4e40f98,80799e1a6646b6dc,2308.4,взносы на обязательное социальное страхование,0.9999980058502028,1
2021-06-04,d877722ca4e40f98,035fab081fc0922f,2894.68,заработная плата за вторую половину мая 21 г для зачисления на счет ермошкина михаила юрьевича сумма 2894-68 без налога (ндс),0.9999980058502028,1
2021-06-04,d877722ca4e40f98,917804652432403b,4999.97,оплата по исполнительный листу № № 2-7123/16 от date_178e735fd502 ермошкин м.ю. взыскателю ким натальи аркадьевны. за май 2021г,0.9999980058502028,1
2021-06-04,d877722ca4e40f98,80799e1a6646b6dc,5664.25,страховые взносы на обязательное медицинское страхование,0.9999980058502028,1
2021-06-04,d877722ca4e40f98,6290b8d67943ece5,5789.37,заработная плата за вторую половину мая 21г для зачисления на счет таранова константина анатольевича сумма 5789-37 без налога (ндс),0.9999980058502028,1
2021-06-04,d877722ca4e40f98,80799e1a6646b6dc,13350.0,налог на доходы физических лиц за май 2021 года,0.9999980058502028,1
2021-06-04,d877722ca4e40f98,80799e1a6646b6dc,20721.35,страховые взносы на выплату страховой части трудовой пенсии,0.9999980058502028,1
2021-06-04,d877722ca4e40f98,8d9e0be733f77f1c,38263.24,заработная плата по реестру №13 от date_bdbe87fa94b3 в соответствии с договором 50356798 от date_eb8c294d74c6,0.9999980058502028,1
2021-06-04,8d9e0be733f77f1c,d877722ca4e40f98,100000.0,"<si>прием ден. нал. через ус 60007270 date_bdbe87fa94b3 09:16:39 вноситель аман вадим владимирович(170091651) 14, займы займ от учеридителя хо сон дя",0.9999980058502028,1
2021-06-07,d877722ca4e40f98,8d9e0be733f77f1c,450.0,комиссия за прием наличных денежных средств через банкомат. документ(ы): №35 (150000 rur ) от 07/06/21. без ндс,0.9999980058502028,1
2021-05-11,d877722ca4e40f98,80799e1a6646b6dc,1111.0,налог на доходы физических лиц за май 2021 года с отпукных,0.9999980058502028,1
2021-05-11,d877722ca4e40f98,a982dff7a672f998,1000.0,оплата за услуги связи л/с inn_a388b319cfe4 сумма 1000-00 в т.ч. ндс (20%) 166-67,0.9999980058502028,1
2021-05-11,d877722ca4e40f98,a4bb2adbd377d7b6,602.07,оплата по счету №1120 то тревожной сигнализации за апрель 21г сумма 602-07 без налога (ндс),0.9999980058502028,1
2021-04-09,8d9e0be733f77f1c,d877722ca4e40f98,150000.0,"<si>прием ден. нал. через ус 60007270 date_bdd3230d7d16 08:52:27 вноситель аман вадим владимирович(170091651) 14, займы займ от учеридителя хо сон дя",0.9999980058502028,1
2021-04-14,d877722ca4e40f98,8d9e0be733f77f1c,8.0,комиссия внутри сбербанка за пп/пт через дбо согласно договору рко № acc_ded93f97f389 от '02/12/2014'. №125 (327360 rur ) от 14/04/21. без ндс,0.9999980058502028,1
2021-04-14,d877722ca4e40f98,8d9e0be733f77f1c,37.0,"комиссия в другие банки (кредитные организации, банк россии) за пп/пт через дбо согласно договору рко №acc_ded93f97f389 от '02/12/2014'. документы: №124 (5438.5 rur ) от 14/04/21 без ндс",0.9999980058502028,1
2021-04-14,d877722ca4e40f98,8d9e0be733f77f1c,1050.0,комиссия за прием наличных денежных средств через банкомат. документ(ы): №18 (350000 rur ) от 14/04/21. без ндс,0.9999980058502028,1
2021-04-14,d877722ca4e40f98,cf603eadad6f36c6,5438.5,оплата по с/ф юс001913 от 31.03.21 услуги по контролю за трансляцией сигналов,0.9999980058502028,1
2021-04-14,d877722ca4e40f98,41face6c4b94dd88,327360.0,оплата по счету № 140 от 31.03.21г услуги физ.охраны за март 21г сумма 327360-00 без налога (ндс),0.9999980058502028,1
2021-04-14,8d9e0be733f77f1c,d877722ca4e40f98,350000.0,"<si>прием ден. нал. через ус 60007270 date_c16445549c34 08:47:24 вноситель аман вадим владимирович(170091651) 14, займы займ от учеридителя хо сон дя",0.9999980058502028,1
2021-04-20,d877722ca4e40f98,8d9e0be733f77f1c,8.0,комиссия внутри сбербанка за пп/пт через дбо согласно договору рко № acc_ded93f97f389 от '02/12/2014'. №130 (155000 rur ) от 20/04/21. без ндс,0.9999980058502028,1
2021-04-20,d877722ca4e40f98,8d9e0be733f77f1c,15.0,комиссия за прием наличных денежных средств через банкомат. документ(ы): №20 (5000 rur ) от 20/04/21. без ндс,0.9999980058502028,1
2021-04-20,d877722ca4e40f98,8d9e0be733f77f1c,37.5,"комиссия за перечисление средств со сч. юл на сч.фл (в т.ч. при закрытии счета), (оборот до 150 тыс. руб) по дог. рко №acc_ded93f97f389 от '02/12/2014'. за документы: документ(ы):; от 20/04/21 №№: 128 (249",0.9999980058502028,1
2021-04-20,d877722ca4e40f98,8d9e0be733f77f1c,74.0,"комиссия в другие банки (кредитные организации, банк россии) за пп/пт через дбо согласно договору рко №acc_ded93f97f389 от '02/12/2014'. документы: документ(ы):; от 20/04/21 №№: 126 (160000 rur ), 127 (30",0.9999980058502028,1
2021-04-20,d877722ca4e40f98,8d9e0be733f77f1c,465.0,комиссия за прием наличных денежных средств через банкомат. документ(ы): №21 (155000 rur ) от 20/04/21. без ндс,0.9999980058502028,1
2021-04-20,d877722ca4e40f98,8d9e0be733f77f1c,615.0,комиссия за прием наличных денежных средств через банкомат. документ(ы): №19 (205000 rur ) от 20/04/21. без ндс,0.9999980058502028,1
2021-04-20,d877722ca4e40f98,035fab081fc0922f,2499.98,заработная плата за первую половину апреля 21 г для зачисления на счет ермошкина михаила юрьевича сумма 2499-98 без налога (ндс),0.9999980058502028,1
2021-04-20,d877722ca4e40f98,ac31ae518119510a,3000.0,оплата по счету № 58793 от 23.04.21 за май 21г сумма 3000-00 без налога (ндс),0.9999980058502028,1
2021-04-20,d877722ca4e40f98,6290b8d67943ece5,4999.97,заработная плата за первую половину апреля 21г для зачисления на счет таранова константина анатольевича сумма 4999-97 без налога (ндс),0.9999980058502028,1
2021-04-20,d877722ca4e40f98,8d9e0be733f77f1c,36589.08,аванс по заработной плате по реестру №7 от date_f5e1c8472c67 в соответствии с договором 50356798 от date_eb8c294d74c6,0.9999980058502028,1
2021-04-20,d877722ca4e40f98,35a482f88fe31cd3,155000.0,"оплата по счету № 6 от 19.04.21 подготовка тех.плана,межевого плана. сумма 155000-00 без налога (ндс)",0.9999980058502028,1
2021-04-12,d877722ca4e40f98,8d9e0be733f77f1c,81.82,оплата комиссии за оказание услуг по зачислению денежных средств. за период с date_92c48cc2ad14 по date_83587c3e44e9. договор от date_eb8c294d74c6 № 50356798. ндс не облагается.,0.9999980058502028,1
2021-04-09,d877722ca4e40f98,1d83fd5f5fefc19f,51991.94,оплата по договору № 3510 от date_f300508e7393 теплоэнергия по с/ф тэ000005265 от 31.03.21 за минусом корректировки за фераль 21г сумма 51991-94 в т.ч. ндс (20%) 8665-32,0.9999980058502028,1
2021-04-20,8a71b7ac75997883,d877722ca4e40f98,3000.0,"возврат пп 127 от date_f5e1c8472c67 на сумму руб 3000,00. реквизиты получателя некорректны/не найдены",0.9999980058502028,1
2021-04-09,d877722ca4e40f98,eed8b1f54ed4366c,31500.0,оплата по договору электроэнергия по дог.№112458 от 03.03.17 аванс 70% за апрель 2021г по с/ф 14037-080-02 от 31.03.21г сумма 31500-00 в т.ч. ндс (20%) 5250-00,0.9999980058502028,1
2021-04-05,d877722ca4e40f98,8d9e0be733f77f1c,270.0,комиссия за прием наличных денежных средств через банкомат. документ(ы): №16 (90000 rur ) от 05/04/21. без ндс,0.9999980058502028,1
2021-04-05,d877722ca4e40f98,ca3891c167141f4d,681.49,взносы на обязательное страхование от несчастных случаев. регистрационный номер в фсс inn_f24b52802750,0.9999980058502028,1
2021-04-05,d877722ca4e40f98,80799e1a6646b6dc,2483.81,взносы на обязательное социальное страхование,0.9999980058502028,1
2021-04-05,d877722ca4e40f98,035fab081fc0922f,2727.21,заработная плата за вторую половину марта 21 г для зачисления на счет ермошкина михаила юрьевича сумма 2727-21 без налога (ндс),0.9999980058502028,1
2021-04-05,d877722ca4e40f98,917804652432403b,4999.47,оплата по исполнительный листу № № 2-7123/16 от date_178e735fd502 ермошкин м.ю. взыскателю ким натальи аркадьевны. за март 2021г,0.9999980058502028,1
2021-04-05,d877722ca4e40f98,6290b8d67943ece5,5454.42,заработная плата за вторую половину марта 21г для зачисления на счет таранова константина анатольевича сумма 5454-42 без налога (ндс),0.9999980058502028,1
2021-04-05,d877722ca4e40f98,80799e1a6646b6dc,5764.79,страховые взносы на обязательное медицинское страхование,0.9999980058502028,1
2021-04-05,d877722ca4e40f98,80799e1a6646b6dc,14767.0,налог на доходы физических лиц за март 2021 года,0.9999980058502028,1
2021-04-05,d877722ca4e40f98,80799e1a6646b6dc,21636.2,страховые взносы на выплату страховой части трудовой пенсии,0.9999980058502028,1
2021-04-05,d877722ca4e40f98,8d9e0be733f77f1c,40908.44,заработная плата по реестру №6 от date_b7f4d73290fd в соответствии с договором 50356798 от date_eb8c294d74c6,0.9999980058502028,1
2021-04-05,9d8f54ae3b88911b,d877722ca4e40f98,10000.0,оплата по договору беспроцентного займа №ти-22/110221 от 11.02.21г сумма 10000-00 без налога (ндс),0.9999980058502028,1
2021-04-05,8d9e0be733f77f1c,d877722ca4e40f98,90000.0,"<si>прием ден. нал. через ус 60007270 date_b7f4d73290fd 08:57:15 вноситель аман вадим владимирович(170091651) 14, займы займ от учеридителя хо сон дя",0.9999980058502028,1
2021-04-09,d877722ca4e40f98,8d9e0be733f77f1c,16.0,"комиссия внутри сбербанка за пп/пт через дбо согласно договору рко № acc_ded93f97f389 от '02/12/2014'. документ(ы):; от 09/04/21 №№: 122 (31500 rur ), 123 (12843 rur ). без ндс",0.9999980058502028,1
2021-04-09,d877722ca4e40f98,8d9e0be733f77f1c,74.0,"комиссия в другие банки (кредитные организации, банк россии) за пп/пт через дбо согласно договору рко №acc_ded93f97f389 от '02/12/2014'. документы: документ(ы):; от 09/04/21 №№: 120 (51991.94 rur ), 121 (",0.9999980058502028,1
2021-04-09,d877722ca4e40f98,8d9e0be733f77f1c,450.0,комиссия за прием наличных денежных средств через банкомат. документ(ы): №17 (150000 rur ) от 09/04/21. без ндс,0.9999980058502028,1
2021-04-09,d877722ca4e40f98,40149916b115417d,12832.57,оплата по договору № 1086 по с/ф inn_bf8fd87e7293 от 31.03.21 сумма 12832-57 в т.ч. ндс (20%) 2138-76,0.9999980058502028,1
2021-04-09,d877722ca4e40f98,eed8b1f54ed4366c,12843.0,оплата по договору электроэнергия по дог.№112458 от 03.03.17 доплата за март 2021г по с/ф 14037-080-02 от 31.03.21г сумма 12843-00 в т.ч. ндс (20%) 2140-50,0.9999980058502028,1
2021-04-20,d877722ca4e40f98,1d83fd5f5fefc19f,160000.0,оплата по договору № 3510 от date_f300508e7393 теплоэнергия по с/ф тэ000001385 от 31.01.21г сумма 160000-00 в т.ч. ндс (20%) 26666-67,0.9999980058502028,1
2021-04-20,8d9e0be733f77f1c,d877722ca4e40f98,5000.0,"<si>прием ден. нал. через ус 60007270 date_f5e1c8472c67 00:20:08 вноситель аман вадим владимирович(170091651) 14, займы займ от учеридителя хо сон дя",0.9999980058502028,1
2021-05-11,d877722ca4e40f98,8d9e0be733f77f1c,74.0,"комиссия в другие банки (кредитные организации, банк россии) за пп/пт через дбо согласно договору рко №acc_ded93f97f389 от '02/12/2014'. документы: документ(ы):; от 11/05/21 №№: 150 (99401.87 rur ), 149 (",0.9999980058502028,1
2021-05-05,d877722ca4e40f98,ca3891c167141f4d,697.17,взносы на обязательное страхование от несчастных случаев. регистрационный номер в фсс inn_f24b52802750,0.9999980058502028,1
2021-05-05,d877722ca4e40f98,8d9e0be733f77f1c,1485.0,комиссия за прием наличных денежных средств через банкомат. документ(ы): №23 (495000 rur ) от 05/05/21. без ндс,0.9999980058502028,1
2021-05-05,d877722ca4e40f98,80799e1a6646b6dc,2286.9,взносы на обязательное социальное страхование,0.9999980058502028,1
2021-05-05,d877722ca4e40f98,035fab081fc0922f,2499.98,заработная плата за вторую половину апреля 21 г для зачисления на счет ермошкина михаила юрьевича сумма 2499-98 без налога (ндс),0.9999980058502028,1
2021-05-05,d877722ca4e40f98,6290b8d67943ece5,4999.96,заработная плата за вторую половину апреля 21г для зачисления на счет таранова константина анатольевича сумма 4999-96 без налога (ндс),0.9999980058502028,1
2021-05-05,d877722ca4e40f98,917804652432403b,4999.97,оплата по исполнительный листу № № 2-7123/16 от date_178e735fd502 ермошкин м.ю. взыскателю ким натальи аркадьевны. за апрель 2021г,0.9999980058502028,1
2021-05-05,d877722ca4e40f98,80799e1a6646b6dc,5888.6,страховые взносы на обязательное медицинское страхование,0.9999980058502028,1
2021-05-05,d877722ca4e40f98,80799e1a6646b6dc,15105.0,налог на доходы физических лиц за апрель 2021 года,0.9999980058502028,1
2021-05-05,d877722ca4e40f98,80799e1a6646b6dc,21082.46,страховые взносы на выплату страховой части трудовой пенсии,0.9999980058502028,1
2021-05-05,d877722ca4e40f98,8d9e0be733f77f1c,32501.01,заработная плата по реестру №8 от date_3100ccd68dab в соответствии с договором 50356798 от date_eb8c294d74c6,0.9999980058502028,1
2021-05-05,d877722ca4e40f98,032f0b4d2498f263,1000000.0,частичный возврат займа по договору №1 от date_1621fe873e05 сумма 1000000-00 без налога (ндс),0.9999980058502028,1
2021-05-05,8d9e0be733f77f1c,d877722ca4e40f98,5000.0,"<si>прием ден. нал. через ус 60007270 date_3100ccd68dab 07:55:17 вноситель аман вадим владимирович(170091651) 14, займы займ от учеридителя хо сон дя",0.9999980058502028,1
2021-05-05,8d9e0be733f77f1c,d877722ca4e40f98,5000.0,"<si>прием ден. нал. через ус 60007270 date_3100ccd68dab 08:05:14 вноситель аман вадим владимирович(170091651) 14, займы займ от учеридителя хо сон дя",0.9999980058502028,1
2021-05-05,9d8f54ae3b88911b,d877722ca4e40f98,10000.0,оплата по договору беспроцентного займа №ти-22/110221 от 11.02.21г сумма 10000-00 без налога (ндс),0.9999980058502028,1
2021-05-05,8d9e0be733f77f1c,d877722ca4e40f98,495000.0,"<si>прием ден. нал. через ус 60007270 date_3100ccd68dab 07:50:03 вноситель аман вадим владимирович(170091651) 14, займы займ от учеридителя хо сон дя",0.9999980058502028,1
2021-05-05,8d9e0be733f77f1c,d877722ca4e40f98,495000.0,"<si>прием ден. нал. через ус 60007270 date_3100ccd68dab 08:01:31 вноситель аман вадим владимирович(170091651) 14, займы займ от учеридителя хо сон дя",0.9999980058502028,1
2021-05-11,d877722ca4e40f98,8d9e0be733f77f1c,24.0,"комиссия внутри сбербанка за пп/пт через дбо согласно договору рко № acc_ded93f97f389 от '02/12/2014'. документ(ы):; от 11/05/21 №№: 148 (20790 rur ), 145 (1000 rur ), 146 (602.07 rur ). без ндс",0.9999980058502028,1
2021-05-11,d877722ca4e40f98,8d9e0be733f77f1c,65.0,оплата комиссии за оказание услуг по зачислению денежных средств. за период с date_a2190548e200 по date_7ec6992ab1f3. договор от date_eb8c294d74c6 № 50356798. ндс не облагается.,0.9999980058502028,1
2021-05-05,d877722ca4e40f98,8d9e0be733f77f1c,1485.0,комиссия за прием наличных денежных средств через банкомат. документ(ы): №25 (495000 rur ) от 05/05/21. без ндс,0.9999980058502028,1
2021-05-05,d877722ca4e40f98,8d9e0be733f77f1c,37.5,"комиссия за перечисление средств со сч. юл на сч.фл (в т.ч. при закрытии счета), (оборот до 150 тыс. руб) по дог. рко №acc_ded93f97f389 от '02/12/2014'. за документы: документ(ы):; от 05/05/21 №№: 140 (249",0.9999980058502028,1
2021-04-20,8d9e0be733f77f1c,d877722ca4e40f98,155000.0,"<si>прием ден. нал. через ус 60007270 date_f5e1c8472c67 08:50:08 вноситель аман вадим владимирович(170091651) 14, займы займ от учеридителя хо сон дя",0.9999980058502028,1
2021-05-05,d877722ca4e40f98,8d9e0be733f77f1c,37.0,"комиссия в другие банки (кредитные организации, банк россии) за пп/пт через дбо согласно договору рко №acc_ded93f97f389 от '02/12/2014'. документы: №142 (4999.97 rur ) от 05/05/21 без ндс",0.9999980058502028,1
2021-04-20,8d9e0be733f77f1c,d877722ca4e40f98,205000.0,"<si>прием ден. нал. через ус 60007270 date_f5e1c8472c67 00:18:55 вноситель аман вадим владимирович(170091651) 14, займы займ от учеридителя хо сон дя",0.9999980058502028,1
2021-04-21,d877722ca4e40f98,8d9e0be733f77f1c,37.0,"комиссия в другие банки (кредитные организации, банк россии) за пп/пт через дбо согласно договору рко №acc_ded93f97f389 от '02/12/2014'. документы: №132 (3000 rur ) от 21/04/21 без ндс",0.9999980058502028,1
2021-04-21,d877722ca4e40f98,8d9e0be733f77f1c,50.0,"комиссия за перечисление средств со сч. юл на сч.фл (в т.ч. при закрытии счета), (оборот до 150 тыс. руб) по дог. рко №acc_ded93f97f389 от '02/12/2014'. за документы:№131 (10000 rur ) от 21/04/21. без ндс",0.9999980058502028,1
2021-04-21,d877722ca4e40f98,8d9e0be733f77f1c,73.18,оплата комиссии за оказание услуг по зачислению денежных средств. за период с date_f3e9243eb4c6 по date_f5e1c8472c67. договор от date_eb8c294d74c6 № 50356798. ндс не облагается.,0.9999980058502028,1
2021-04-21,d877722ca4e40f98,ac31ae518119510a,3000.0,оплата по счету № 58793 от 23.04.21 за май 21г сумма 3000-00 без налога (ндс),0.9999980058502028,1
2021-04-21,d877722ca4e40f98,01e8b06bcab97b76,10000.0,перечисление подотчетной суммы на карту и татьяны юрьевны сумма 10000-00 без налога (ндс),0.9999980058502028,1
2021-04-29,d877722ca4e40f98,8d9e0be733f77f1c,20.0,"комиссия за перечисление средств со сч. юл на сч.фл (в т.ч. при закрытии счета), (оборот до 150 тыс. руб) по дог. рко №acc_ded93f97f389 от '02/12/2014'. за документы:№133 (4000 rur ) от 29/04/21. без ндс",0.9999980058502028,1
2021-04-29,d877722ca4e40f98,225acb9ed4f34af6,4000.0,перечисление подотчетной суммы сумма 4000-00 без налога (ндс),0.9999980058502028,1
2021-04-30,d877722ca4e40f98,8d9e0be733f77f1c,8.0,комиссия внутри сбербанка за пп/пт через дбо согласно договору рко № acc_ded93f97f389 от '02/12/2014'. №134 (82192 rur ) от 30/04/21. без ндс,0.9999980058502028,1
2021-04-30,d877722ca4e40f98,8d9e0be733f77f1c,405.0,комиссия за прием наличных денежных средств через банкомат. документ(ы): №22 (135000 rur ) от 30/04/21. без ндс,0.9999980058502028,1
2021-04-30,d877722ca4e40f98,032f0b4d2498f263,82192.0,оплата процентов по договору процентного денежного займа №1 от 17.12.20г сумма 82192-00 без налога (ндс),0.9999980058502028,1
2021-04-30,8d9e0be733f77f1c,d877722ca4e40f98,135000.0,"<si>прием ден. нал. через ус 60007270 date_a2190548e200 08:48:59 вноситель аман вадим владимирович(170091651) 14, займы займ от учеридителя хо сон дя",0.9999980058502028,1
2021-05-03,d877722ca4e40f98,8d9e0be733f77f1c,199.0,информирование об операциях поступления и/или списания по банковскому(им) счету(ам) в рублях рф за период с '01/04/2021' по '30/04/2021'.,0.9999980058502028,1
2021-05-04,d877722ca4e40f98,8d9e0be733f77f1c,1800.0,комиссия за ведение счета 'acc_ded93f97f389' от '02/12/2014' за период с '01/04/2021' по '30/04/2021' за 30 дней. ндс не облагается,0.9999980058502028,1
2021-05-05,d877722ca4e40f98,8d9e0be733f77f1c,8.0,комиссия внутри сбербанка за пп/пт через дбо согласно договору рко № acc_ded93f97f389 от '02/12/2014'. №143 (1000000 rur ) от 05/05/21. без ндс,0.9999980058502028,1
2021-05-05,d877722ca4e40f98,8d9e0be733f77f1c,15.0,комиссия за прием наличных денежных средств через банкомат. документ(ы): №26 (5000 rur ) от 05/05/21. без ндс,0.9999980058502028,1
2021-05-05,d877722ca4e40f98,8d9e0be733f77f1c,15.0,комиссия за прием наличных денежных средств через банкомат. документ(ы): №24 (5000 rur ) от 05/05/21. без ндс,0.9999980058502028,1
2021-06-12,8d9e0be733f77f1c,d877722ca4e40f98,150000.0,"<si>прием ден. нал. через ус 60000633 date_5d8efcdefcf4 09:57:24 вноситель аман вадим владимирович(170091651) 14, займы займ от учеридителя хо сон дя",0.9999980058502028,1
2021-06-13,d877722ca4e40f98,8d9e0be733f77f1c,450.0,комиссия за прием наличных денежных средств через банкомат. документ(ы): №41 (150000 rur ) от 13/06/21. без ндс,0.9999980058502028,1
2021-06-13,8d9e0be733f77f1c,d877722ca4e40f98,150000.0,"<si>прием ден. нал. через ус 60030321 date_68a220a28b9d 09:14:24 вноситель аман вадим владимирович(170091651) 14, займы займ от учеридителя хо сон дя",0.9999980058502028,1
2021-07-12,d877722ca4e40f98,eed8b1f54ed4366c,12978.0,оплата по договору электроэнергия по дог.№112458 от 03.03.17 аванс 70% за июль 2021г по с/ф 29483-080-02 от 30.06.21г сумма 12978-00 в т.ч. ндс (20%) 2163-00,0.9999980058502028,1
2021-07-12,d877722ca4e40f98,85ee5df9d37a27a6,272215.0,оплата по сч.№ 05 от 18.02.21 г частичная оплата авторский надзор за холодсервис согласно письма №46 от 18.12.18г сумма 272215-00 без налога (ндс),0.9999980058502028,1
2021-07-12,d877722ca4e40f98,85ee5df9d37a27a6,296682.0,оплата по сч.№ 8 от 21.05.21г авторский надзор за холодсервис согласно письма №46 от 18.12.18г сумма 296682-00 без налога (ндс),0.9999980058502028,1
2021-07-12,8d9e0be733f77f1c,d877722ca4e40f98,25473.0,выдача кредита по договору n600210017 от 24 июня 2021 г. согласно распоряжения кредитного отдела n 46185106 от date_246c0b17af4d. ндс нет.,0.9999980058502028,1
2021-07-12,8d9e0be733f77f1c,d877722ca4e40f98,719384.0,частичный возврат суммы покрытия по аккредитиву №8824s2107000h от date_95feb18422fb в связи с изменением суммы аккредитива на основании заявления №7 от 12.07.2021г.,0.9999980058502028,1
2021-07-13,d877722ca4e40f98,8d9e0be733f77f1c,8.0,комиссия внутри сбербанка за пп/пт через дбо согласно договору рко № acc_ded93f97f389 от '02/12/2014'. №240 (603621 rur ) от 13/07/21. без ндс,0.9999980058502028,1
2021-07-13,d877722ca4e40f98,f0be9c0037548bf2,603621.0,оплата по счету № 6304 от date_43f2f1b3167e монтаж и наладка пожарной сигнализации по дог.№120/20 от 18.12.20 частичная оплата сумма 603621-00 без налога (ндс),0.9999980058502028,1
2021-07-16,d877722ca4e40f98,8d9e0be733f77f1c,8.0,комиссия внутри сбербанка за пп/пт через дбо согласно договору рко № acc_ded93f97f389 от '02/12/2014'. №242 (4000 rur ) от 16/07/21. без ндс,0.9999980058502028,1
2021-07-16,d877722ca4e40f98,8d9e0be733f77f1c,37.0,"комиссия в другие банки (кредитные организации, банк россии) за пп/пт через дбо согласно договору рко №acc_ded93f97f389 от '02/12/2014'. документы: №241 (18900000 rur ) от 16/07/21 без ндс",0.9999980058502028,1
2021-07-16,d877722ca4e40f98,d165cf0df41bf2b8,4000.0,оплата по счету № 744 от 07.07.21г за учебу сумма 4000-00 без налога (ндс),0.9999980058502028,1
2021-07-16,d877722ca4e40f98,365a9e654bc3d301,18900000.0,оплата по сч.№ 33 от 16.07.21 согласно договора № 16-21 реконструкция теплотрассы и монтаж электрич сетей сумма 18900000-00 без налога (ндс),0.9999980058502028,1
2021-07-16,8d9e0be733f77f1c,d877722ca4e40f98,18900000.0,частичный возврат суммы покрытия по аккредитиву № 8824s2107000h от 07.07.2021г в связи с изменением суммы аккредитива на основании заявления № 11 от 16.07.2021г..,0.9999980058502028,1
2021-07-20,d877722ca4e40f98,8d9e0be733f77f1c,37.5,"комиссия за перечисление средств со сч. юл на сч.фл (в т.ч. при закрытии счета), (оборот до 150 тыс. руб) по дог. рко №acc_ded93f97f389 от '02/12/2014'. за документы: документ(ы):; от 20/07/21 №№: 252 (249",0.9999980058502028,1
2021-07-20,d877722ca4e40f98,8d9e0be733f77f1c,40.0,"комиссия внутри сбербанка за пп/пт через дбо согласно договору рко № acc_ded93f97f389 от '02/12/2014'. документ(ы):; от 20/07/21 №№: 243 (211065 rur ), 244 (359615 rur ), 245 (444126 rur ), 246 (283277",0.9999980058502028,1
2021-07-20,d877722ca4e40f98,035fab081fc0922f,2499.98,заработная плата за первую половину июля 21 г для зачисления на счет ермошкина михаила юрьевича сумма 2499-98 без налога (ндс),0.9999980058502028,1
2021-07-20,d877722ca4e40f98,6290b8d67943ece5,4999.98,заработная плата за первую половину июля 21г для зачисления на счет таранова константина анатольевича сумма 4999-97 без налога (ндс) в том числе ндс - 0.00 рублей.,0.9999980058502028,1
2021-07-20,d877722ca4e40f98,80799e1a6646b6dc,19413.0,земельный налог за 2 квартал 2021 года,0.9999980058502028,1
2021-07-20,d877722ca4e40f98,8d9e0be733f77f1c,37499.98,аванс по заработной плате по реестру №16 от date_68f38ec7c834 в соответствии с договором 50356798 от date_eb8c294d74c6,0.9999980058502028,1
2021-07-12,d877722ca4e40f98,85ee5df9d37a27a6,150487.0,оплата по сч.№ 7 от date_19d88b79d5fb авторский надзор за холодсервис согласно письма №46 от 18.12.18г сумма 150487-00 без налога (ндс),0.9999980058502028,1
2021-07-12,d877722ca4e40f98,767c3f5f72b4494f,7705.0,оплата по счету № 6042 от 09.07.21г спецодежда сумма 7705-00 в т.ч. ндс (20%) 1284-17,0.9999980058502028,1
2021-07-20,d877722ca4e40f98,777e4d144e99f74a,211065.0,оплата по счету № 6 от date_19d88b79d5fb тех.надзор по договору №8 от 20.12.16г сумма 211065-00 без налога (ндс),0.9999980058502028,1
2021-07-12,d877722ca4e40f98,eed8b1f54ed4366c,2790.0,оплата по договору электроэнергия по дог.№112458 от 03.03.17 доплата за июнь 2021г по с/ф 29483-080-02 от 30.06.21г сумма 2790-00 в т.ч. ндс (20%) 465-00,0.9999980058502028,1
2021-07-08,d877722ca4e40f98,6931e23e98703aa9,9892831.0,оплата по счету № 20 от date_12a233039899 благоустройство.устройство проездов и тротуаров cогласно договора подряда №3-тор от 19.05.17г сумма 9892831-00 в т.ч. ндс (20%) 1648805-00,0.9999980058502028,1
2021-07-08,d877722ca4e40f98,6931e23e98703aa9,26297591.0,частичная оплата по счету №9 от date_aaac92e3774d cогласно договора подряда №3-тор от 19.05.17г сумма 26297591-00 в т.ч. ндс (20%) 4382932-00,0.9999980058502028,1
2021-07-08,8d9e0be733f77f1c,d877722ca4e40f98,68060174.0,выдача кредита по договору n600210017 от 24 июня 2021 г. согласно распоряжения кредитного отдела n 46070607 от date_cddc49f67133. ндс нет.,0.9999980058502028,1
2021-07-09,d877722ca4e40f98,8d9e0be733f77f1c,16.0,"комиссия внутри сбербанка за пп/пт через дбо согласно договору рко № acc_ded93f97f389 от '02/12/2014'. документ(ы):; от 09/07/21 №№: 227 (69500000 rur ), 232 (316800 rur ). без ндс",0.9999980058502028,1
2021-07-09,d877722ca4e40f98,8d9e0be733f77f1c,148.0,"комиссия в другие банки (кредитные организации, банк россии) за пп/пт через дбо согласно договору рко №acc_ded93f97f389 от '02/12/2014'. документы: документ(ы):; от 09/07/21 №№: 230 (8341.16 rur ), 231 (3",0.9999980058502028,1
2021-07-09,d877722ca4e40f98,40149916b115417d,8341.16,оплата по счет-фактуре № inn_da53825e5faf от date_e2f6fdea7672 договор № 1086 сумма 8341-16 в т.ч. ндс (20%) 1390-19,0.9999980058502028,1
2021-07-09,d877722ca4e40f98,1d83fd5f5fefc19f,31665.29,оплата по договору № 3510 от date_81763ef137aa теплоэнергия по с/ф тэ000010953 от 30.06.21 г за июнь 2021г сумма 31665-29 в т.ч. ндс (20%) 5277-55,0.9999980058502028,1
2021-07-09,d877722ca4e40f98,365a9e654bc3d301,80000.0,оплата по счету № 73 от date_63da1f80aee8 строительство теплотрассы сумма 80000-00 без налога (ндс),0.9999980058502028,1
2021-07-09,d877722ca4e40f98,41face6c4b94dd88,316800.0,оплата по счету № 251 от 30.06.21г услуги физ.охраны за июнь 2021г сумма 316800-00 без налога (ндс),0.9999980058502028,1
2021-07-09,d877722ca4e40f98,365a9e654bc3d301,2320696.0,оплата по счету № 7 от date_3967c84bf0f7 внутреннее (временное) электроснабжение сумма 2320696-00 без налога (ндс),0.9999980058502028,1
2021-07-09,d877722ca4e40f98,6931e23e98703aa9,69500000.0,"окончательная оплата по счету №9 от date_aaac92e3774d, согласно договора подряда №3-тор от 19.05.17г сумма 69500000-00 в т.ч. ндс (20%) 11583333-00",0.9999980058502028,1
2021-07-09,8d9e0be733f77f1c,d877722ca4e40f98,356806.45,выдача кредита по договору n600210017 от 24 июня 2021 г. согласно распоряжения кредитного отдела n 46122398 от date_72047c68bc98. ндс нет.,0.9999980058502028,1
2021-07-09,8d9e0be733f77f1c,d877722ca4e40f98,71900696.0,"частичный возврат суммы покрытия по аккредитиву № 8824s2107000h от 07,07,2021 в связи с изменением суммы аккредитива на основании заявления № 5 от 09,07,2021",0.9999980058502028,1
2021-07-12,d877722ca4e40f98,8d9e0be733f77f1c,37.0,"комиссия в другие банки (кредитные организации, банк россии) за пп/пт через дбо согласно договору рко №acc_ded93f97f389 от '02/12/2014'. документы: №237 (7705 rur ) от 12/07/21 без ндс",0.9999980058502028,1
2021-07-12,d877722ca4e40f98,8d9e0be733f77f1c,48.0,"комиссия внутри сбербанка за пп/пт через дбо согласно договору рко № acc_ded93f97f389 от '02/12/2014'. документ(ы):; от 12/07/21 №№: 235 (272215 rur ), 239 (2790 rur ), 238 (12978 rur ), 236 (2000 rur",0.9999980058502028,1
2021-07-12,d877722ca4e40f98,8d9e0be733f77f1c,78.57,оплата комиссии за оказание услуг по зачислению денежных средств. за период с date_e2f6fdea7672 по date_6e9a6ace6def. договор от date_eb8c294d74c6 № 50356798. ндс не облагается.,0.9999980058502028,1
2021-07-12,d877722ca4e40f98,a982dff7a672f998,2000.0,оплата за услуги связи л/с inn_a388b319cfe4 сумма 2000-00 в т.ч. ндс (20%) 333-33,0.9999980058502028,1
2021-07-20,d877722ca4e40f98,80799e1a6646b6dc,46837.85,налог на имущество организаций за 1 квартал 2021 года,0.9999980058502028,1
2021-07-20,d877722ca4e40f98,777e4d144e99f74a,283277.0,оплата по счету №4 от date_6b14695a421e тех.надзор по договору №8 от 20.12.16г сумма 283277-00 без налога (ндс),0.9999980058502028,1
2021-07-08,d877722ca4e40f98,6931e23e98703aa9,6292056.0,оплата по счету № 15 от 10.08.2020г пусконаладочные работы.система отопления cогласно договора подряда №3-тор от 19.05.17г сумма 6292056-00 в т.ч. ндс (20%) 1048676-00,0.9999980058502028,1
2021-07-30,d877722ca4e40f98,80799e1a6646b6dc,0.3,пени по налогу на доходы физических лиц за май 2021 года,0.9999980058502028,1
2021-07-30,d877722ca4e40f98,8d9e0be733f77f1c,37.0,"комиссия в другие банки (кредитные организации, банк россии) за пп/пт через дбо согласно договору рко №acc_ded93f97f389 от '02/12/2014'. документы: №255 (.01 rur ) от 30/07/21 без ндс",0.9999980058502028,1
2021-07-30,d877722ca4e40f98,80799e1a6646b6dc,58.0,налог на доходы физических лиц доплата за май 2021 года,0.9999980058502028,1
2021-07-30,d877722ca4e40f98,80799e1a6646b6dc,1763.0,налог на доходы физических лиц за июль 2021 года,0.9999980058502028,1
2021-08-02,d877722ca4e40f98,8d9e0be733f77f1c,74.0,"комиссия в другие банки (кредитные организации, банк россии) за пп/пт через дбо согласно договору рко №acc_ded93f97f389 от '02/12/2014'. документы: документ(ы):; от 02/08/21 №№: 262 (3000 rur ), 263 (3000",0.9999980058502028,1
2021-08-02,d877722ca4e40f98,8d9e0be733f77f1c,1800.0,комиссия за ведение счета 'acc_ded93f97f389' от '02/12/2014' за период с '01/07/2021' по '31/07/2021' за 31 дней. ндс не облагается,0.9999980058502028,1
2021-08-02,d877722ca4e40f98,ac31ae518119510a,3000.0,оплата по счету № 65926 от 23.07.21 за август 21г сумма 3000-00 без налога (ндс),0.9999980058502028,1
2021-08-02,d877722ca4e40f98,ac31ae518119510a,3000.0,оплата по счету № 63708 от 23.06.21г за июль 21г сумма 3000-00 без налога (ндс),0.9999980058502028,1
2021-08-03,d877722ca4e40f98,8d9e0be733f77f1c,199.0,информирование об операциях поступления и/или списания по банковскому(им) счету(ам) в рублях рф за период с '01/07/2021' по '31/07/2021'.,0.9999980058502028,1
2021-08-03,d877722ca4e40f98,8d9e0be733f77f1c,14250.0,отпускные по реестру №19 от date_8900e9d13cb6 в соответствии с договором 50356798 от date_eb8c294d74c6,0.9999980058502028,1
2021-08-03,7ad54077510c09e4,d877722ca4e40f98,14000.0,выдача займа по договору №4-си/170621 от date_8b1fbb2a73df сумма 14000-00 без налога (ндс),0.9999980058502028,1
2021-08-05,d877722ca4e40f98,8d9e0be733f77f1c,37.0,"комиссия в другие банки (кредитные организации, банк россии) за пп/пт через дбо согласно договору рко №acc_ded93f97f389 от '02/12/2014'. документы: №271 (4999.97 rur ) от 05/08/21 без ндс",0.9999980058502028,1
2021-08-05,d877722ca4e40f98,8d9e0be733f77f1c,37.5,"комиссия за перечисление средств со сч. юл на сч.фл (в т.ч. при закрытии счета), (оборот до 150 тыс. руб) по дог. рко №acc_ded93f97f389 от '02/12/2014'. за документы: документ(ы):; от 05/08/21 №№: 270 (499",0.9999980058502028,1
2021-08-05,d877722ca4e40f98,ca3891c167141f4d,667.58,взносы на обязательное страхование от несчастных случаев. регистрационный номер в фсс inn_f24b52802750,0.9999980058502028,1
2021-08-05,d877722ca4e40f98,80799e1a6646b6dc,2150.53,взносы на обязательное социальное страхование,0.9999980058502028,1
2021-08-05,d877722ca4e40f98,035fab081fc0922f,2499.98,заработная плата за вторую половину июля 21 г для зачисления на счет ермошкина михаила юрьевича сумма 2499-98 без налога (ндс),0.9999980058502028,1
2021-08-05,d877722ca4e40f98,6290b8d67943ece5,4999.95,заработная плата за вторую половину июля 21г для зачисления на счет таранова константина анатольевича сумма 4999-95 без налога (ндс),0.9999980058502028,1
2021-08-05,d877722ca4e40f98,917804652432403b,4999.97,оплата по исполнительный листу № № 2-7123/16 от date_178e735fd502 ермошкин м.ю. взыскателю ким натальи аркадьевны. за июль 2021г,0.9999980058502028,1
2021-07-30,d877722ca4e40f98,8d9e0be733f77f1c,23.6,оплата комиссии за оказание услуг по зачислению денежных средств. за период с date_f3eb9b50c612 по date_ed6a189f272b. договор от date_eb8c294d74c6 № 50356798. ндс не облагается.,0.9999980058502028,1
2021-07-30,d877722ca4e40f98,93a0e28f1a251bcf,0.01,оплата по сч.№ 687 от 09.07.21г согласно договор_9429076e5a53 №39 ин от 09.07.21г доплата сумма 0-01 без налога (ндс),0.9999980058502028,1
2021-07-20,d877722ca4e40f98,777e4d144e99f74a,359615.0,оплата по счету № 7 от 21.05.19 тех.надзор по договору №8 от 20.12.16г сумма 359615-00 без налога (ндс),0.9999980058502028,1
2021-07-29,d877722ca4e40f98,8d9e0be733f77f1c,1500.0,комиссия за годовое обслуживание бизнес-карты на пластиковом носителе '4274********7698' от '16/07/2021',0.9999980058502028,1
2021-07-20,d877722ca4e40f98,777e4d144e99f74a,444126.0,оплата по счету №5 от date_55fe983d1fa3 тех.надзор по договору №8 от 20.12.16г сумма 444126-00 без налога (ндс),0.9999980058502028,1
2021-07-20,d877722ca4e40f98,80799e1a6646b6dc,1035949.85,налог на имущество организаций за 2 квартал 2021 года,0.9999980058502028,1
2021-07-20,d877722ca4e40f98,80799e1a6646b6dc,1214381.15,налог на имущество организаций за 1 квартал 2021 года,0.9999980058502028,1
2021-07-20,d877722ca4e40f98,777e4d144e99f74a,4931506.0,оплата по счету №1 от date_aa315bd81f11 тех.надзор по договору №8 от 20.12.16г сумма 4931506-00 без налога (ндс),0.9999980058502028,1
2021-07-20,8d9e0be733f77f1c,d877722ca4e40f98,111250.79,выдача кредита по договору n600210017 от 24 июня 2021 г. согласно распоряжения кредитного отдела n 46617919 от date_68f38ec7c834. ндс нет.,0.9999980058502028,1
2021-07-20,8d9e0be733f77f1c,d877722ca4e40f98,8479920.0,возврат неиспользованной суммы по аккредитиву № 8824s2107000h от date_95feb18422fb в связи с заявлением на отзыв аккредитива от date_68f38ec7c834.,0.9999980058502028,1
2021-07-21,d877722ca4e40f98,8d9e0be733f77f1c,75.0,оплата комиссии за оказание услуг по зачислению денежных средств. за период с date_246c0b17af4d по date_68f38ec7c834. договор от date_eb8c294d74c6 № 50356798. ндс не облагается.,0.9999980058502028,1
2021-07-21,0c22384d93788af3,d877722ca4e40f98,2555.17,"acc_204e664ca1bc;возврат согласно заявления ооо ""инкриз"" по дог. № 13866 от date_850656bcdad9",0.9999980058502028,1
2021-07-22,d877722ca4e40f98,8d9e0be733f77f1c,37.0,"комиссия в другие банки (кредитные организации, банк россии) за пп/пт через дбо согласно договору рко №acc_ded93f97f389 от '02/12/2014'. документы: №254 (12963.13 rur ) от 21/07/21 без ндс",0.9999980058502028,1
2021-07-22,d877722ca4e40f98,93a0e28f1a251bcf,12963.13,оплата по сч.№ 687 от 09.07.21г согласно договор_9429076e5a53 №39 ин от 09.07.21г сумма 12963-13 без налога (ндс),0.9999980058502028,1
2021-07-22,8d9e0be733f77f1c,d877722ca4e40f98,12963.13,выдача кредита по договору n600210017 от 24 июня 2021 г. согласно распоряжения кредитного отдела n 46742046 от date_18d445956332. ндс нет.,0.9999980058502028,1
2021-07-23,d877722ca4e40f98,8d9e0be733f77f1c,11799.76,отпускные по реестру №17 от date_51e3fe0b65b0 в соответствии с договором 50356798 от date_eb8c294d74c6,0.9999980058502028,1
2021-07-23,7ad54077510c09e4,d877722ca4e40f98,10000.0,выдача займа по договору №4-си/170621 от date_8b1fbb2a73df сумма 10000-00 без налога (ндс),0.9999980058502028,1
2021-07-28,d877722ca4e40f98,8d9e0be733f77f1c,3000.0,комиссия за прием наличных денежных средств через банкомат. документ(ы): №46 (1000000 rur ) от 28/07/21. без ндс,0.9999980058502028,1
2021-07-28,d877722ca4e40f98,8d9e0be733f77f1c,984604.88,"погашение задолженности по договору n 600210017 от 24 июня 2021 г. клиент ооо ""инкриз""",0.9999980058502028,1
2021-07-28,8d9e0be733f77f1c,d877722ca4e40f98,1000000.0,"<si>прием ден. нал. через ус 60036386 date_83e5ba05d91a 02:29:13 вноситель аман вадим владимирович(170091651) 14, займы займ от учеридителя хо сон дя",0.9999980058502028,1
2021-07-29,d877722ca4e40f98,8d9e0be733f77f1c,1000.0,комиссия за годовое обслуживание бизнес-карты без пластикового носителя '4274********7698' от '16/07/2021',0.9999980058502028,1
2021-07-08,d877722ca4e40f98,6931e23e98703aa9,8843574.0,оплата по счету № 13 от date_3e84c9d36c93 благоустройство. устройство проездов и тротуаров. cогласно договора подряда №3-тор от 19.05.17г сумма 8843574-00 в т.ч. ндс (20%) 1473929-00,0.9999980058502028,1
2021-07-08,d877722ca4e40f98,6931e23e98703aa9,3060000.0,"оплата по счету № 11 от date_bb3d2a3e6d93 отделочные работы. полы, стены, потолки, двери, перегородки. cогласно договора подряда №3-тор от 19.05.17г сумма 3060000-00 в т.ч. ндс (20%) 510000-00",0.9999980058502028,1
2021-06-15,d877722ca4e40f98,8d9e0be733f77f1c,16.0,"комиссия внутри сбербанка за пп/пт через дбо согласно договору рко № acc_ded93f97f389 от '02/12/2014'. документ(ы):; от 15/06/21 №№: 178 (500000 rur ), 179 (1500000 rur ). без ндс",0.9999980058502028,1
2021-06-18,d877722ca4e40f98,035fab081fc0922f,2380.65,заработная плата за первую половину июнь 21 г для зачисления на счет ермошкина михаила юрьевича сумма 2380-65 без налога (ндс),0.9999980058502028,1
2021-06-18,d877722ca4e40f98,8d9e0be733f77f1c,35713.45,аванс по заработной плате по реестру №14 от date_ae551c7cc7b1 в соответствии с договором 50356798 от date_eb8c294d74c6,0.9999980058502028,1
2021-06-21,d877722ca4e40f98,8d9e0be733f77f1c,8.0,комиссия внутри сбербанка за пп/пт через дбо согласно договору рко № acc_ded93f97f389 от '02/12/2014'. №188 (200000 rur ) от 21/06/21. без ндс,0.9999980058502028,1
2021-06-21,d877722ca4e40f98,8d9e0be733f77f1c,37.0,"комиссия в другие банки (кредитные организации, банк россии) за пп/пт через дбо согласно договору рко №acc_ded93f97f389 от '02/12/2014'. документы: №187 (61065.01 rur ) от 21/06/21 без ндс",0.9999980058502028,1
2021-06-21,d877722ca4e40f98,8d9e0be733f77f1c,71.43,оплата комиссии за оказание услуг по зачислению денежных средств. за период с date_34d2aafd5166 по date_fc42b86e6f46. договор от date_eb8c294d74c6 № 50356798. ндс не облагается.,0.9999980058502028,1
2021-06-21,d877722ca4e40f98,8d9e0be733f77f1c,600.0,комиссия за прием наличных денежных средств через банкомат. документ(ы): №45 (200000 rur ) от 21/06/21. без ндс,0.9999980058502028,1
2021-06-21,d877722ca4e40f98,0c22384d93788af3,61065.01,арендная плата за землю по договору №13866 от 26.02.18 за период с 1 апреля по 30 мая 2021 г (вкл).,0.9999980058502028,1
2021-06-21,d877722ca4e40f98,532f3d84ba4caf61,200000.0,возврат основного долга по договору займа №1-пи/120321 от date_624843e4ca2a сумма 200000-00 без налога (ндс),0.9999980058502028,1
2021-06-21,8d9e0be733f77f1c,d877722ca4e40f98,200000.0,"<si>прием ден. нал. через ус 60036386 date_4fe3982c661b 05:16:03 вноситель аман вадим владимирович(170091651) 14, займы займ от учеридителя хо сон дя",0.9999980058502028,1
2021-06-25,d877722ca4e40f98,7b6d655993f0d2ed,2000.0,"госпошлина за государственную регистрацию прав, ограничений (обременений) прав на недвижимое имущество и сделок с ним",0.9999980058502028,1
2021-06-25,d877722ca4e40f98,7b6d655993f0d2ed,2000.0,"госпошлина за государственную регистрацию прав, ограничений (обременений) прав на недвижимое имущество и сделок с ним",0.9999980058502028,1
2021-06-30,d877722ca4e40f98,8d9e0be733f77f1c,8.0,комиссия внутри сбербанка за пп/пт через дбо согласно договору рко № acc_ded93f97f389 от '02/12/2014'. №192 (602.07 rur ) от 30/06/21. без ндс,0.9999980058502028,1
2021-06-30,d877722ca4e40f98,a4bb2adbd377d7b6,602.07,оплата по счету №1841 то тревожной сигнализации за июнь 21г сумма 602-07 без налога (ндс),0.9999980058502028,1
2021-06-30,d877722ca4e40f98,80799e1a6646b6dc,4261.0,налог на доходы физических лиц за июнь 2021 года,0.9999980058502028,1
2021-06-30,41face6c4b94dd88,d877722ca4e40f98,6336.0,оплата по счету № 4 от 28.06.2021г. штраф сумма 6336-00 без налога (ндс),0.9999980058502028,1
2021-06-30,80799e1a6646b6dc,d877722ca4e40f98,17297150.0,"acc_cd27e0d43c60;ст. 176 нк рф, год: 2021 решение n 43021 от date_c360e6c8d02f наименование: ооо ""инкриз"", инн: inn_d877722ca4e4, кпп: 650101001 наименование но: межрайонная инспекция федеральной налоговой службы n 1 по",0.9999980058502028,1
2021-07-01,d877722ca4e40f98,8d9e0be733f77f1c,32.0,"комиссия внутри сбербанка за пп/пт через дбо согласно договору рко № acc_ded93f97f389 от '02/12/2014'. документ(ы):; от 01/07/21 №№: 196 (2016947 rur ), 195 (1760621 rur ), 194 (9472656 rur ), 193 (1750",0.9999980058502028,1
2021-07-01,d877722ca4e40f98,8d9e0be733f77f1c,1800.0,комиссия за ведение счета 'acc_ded93f97f389' от '02/12/2014' за период с '01/06/2021' по '30/06/2021' за 30 дней. ндс не облагается,0.9999980058502028,1
2021-06-18,d877722ca4e40f98,6290b8d67943ece5,4761.3,заработная плата за первую половину июнь 21г для зачисления на счет таранова константина анатольевича сумма 4761-30 без налога (ндс),0.9999980058502028,1
2021-06-18,d877722ca4e40f98,8d9e0be733f77f1c,35.71,"комиссия за перечисление средств со сч. юл на сч.фл (в т.ч. при закрытии счета), (оборот до 150 тыс. руб) по дог. рко №acc_ded93f97f389 от '02/12/2014'. за документы: документ(ы):; от 18/06/21 №№: 185 (238",0.9999980058502028,1
2021-07-01,d877722ca4e40f98,8d9e0be733f77f1c,100000.0,прочие выдачи 100000.00; прочие расходы; по чеку № 11uynt.,0.9999980058502028,1
2021-06-17,d877722ca4e40f98,032f0b4d2498f263,32465.75,оплата процентов за период с 01 по 16.06.21(вкл) по договору процентного денежного займа №1 от 17.12.20г сумма 32465-75 без налога (ндс),0.9999980058502028,1
2021-06-15,d877722ca4e40f98,8d9e0be733f77f1c,150.0,комиссия за прием наличных денежных средств через банкомат. документ(ы): №42 (50000 rur ) от 15/06/21. без ндс,0.9999980058502028,1
2021-06-15,d877722ca4e40f98,8d9e0be733f77f1c,2370.0,комиссия за прием наличных денежных средств через банкомат. документ(ы): №44 (790000 rur ) от 15/06/21. без ндс,0.9999980058502028,1
2021-06-15,d877722ca4e40f98,8d9e0be733f77f1c,3000.0,комиссия за прием наличных денежных средств через банкомат. документ(ы): №43 (1000000 rur ) от 15/06/21. без ндс,0.9999980058502028,1
2021-06-15,d877722ca4e40f98,032f0b4d2498f263,500000.0,частичный возврат займа по договору №1 от date_1621fe873e05 сумма 500000-00 без налога (ндс),0.9999980058502028,1
2021-06-15,d877722ca4e40f98,032f0b4d2498f263,1500000.0,частичный возврат займа по договору №1 от date_1621fe873e05 сумма 1500000-00 без налога (ндс),0.9999980058502028,1
2021-06-15,8d9e0be733f77f1c,d877722ca4e40f98,50000.0,"<si>прием ден. нал. через ус 60036386 date_7eea5fc42c83 01:23:56 вноситель аман вадим владимирович(170091651) 14, займы займ от учеридителя хо сон дя",0.9999980058502028,1
2021-06-15,8d9e0be733f77f1c,d877722ca4e40f98,790000.0,"<si>прием ден. нал. через ус 60036386 date_7eea5fc42c83 05:15:10 вноситель аман вадим владимирович(170091651) 14, займы займ от учеридителя хо сон дя",0.9999980058502028,1
2021-06-15,8d9e0be733f77f1c,d877722ca4e40f98,1000000.0,"<si>прием ден. нал. через ус 60036386 date_7eea5fc42c83 05:12:32 вноситель аман вадим владимирович(170091651) 14, займы займ от учеридителя хо сон дя",0.9999980058502028,1
2021-06-16,d877722ca4e40f98,8d9e0be733f77f1c,8.0,комиссия внутри сбербанка за пп/пт через дбо согласно договору рко № acc_ded93f97f389 от '02/12/2014'. №180 (2000000 rur ) от 16/06/21. без ндс,0.9999980058502028,1
2021-06-16,d877722ca4e40f98,8d9e0be733f77f1c,37.0,"комиссия в другие банки (кредитные организации, банк россии) за пп/пт через дбо согласно договору рко №acc_ded93f97f389 от '02/12/2014'. документы: №181 (16315.5 rur ) от 16/06/21 без ндс",0.9999980058502028,1
2021-06-16,d877722ca4e40f98,cf603eadad6f36c6,16315.5,"оплата по с/ф юс002305 от 30.04.21г, с/ф юс003269 от 31.05.21г, с/ф юс004070 от 30.06.21г услуги по контролю за трансляцией сигналов",0.9999980058502028,1
2021-06-16,d877722ca4e40f98,032f0b4d2498f263,2000000.0,частичный возврат займа по договору №1 от date_1621fe873e05 сумма 2000000-00 без налога (ндс),0.9999980058502028,1
2021-06-16,7ad54077510c09e4,d877722ca4e40f98,1850000.0,выдача займа по договору №3-си/160621 от date_31f6fed8f2d6 сумма 1850000-00 без налога (ндс),0.9999980058502028,1
2021-06-17,d877722ca4e40f98,8d9e0be733f77f1c,8.0,комиссия внутри сбербанка за пп/пт через дбо согласно договору рко № acc_ded93f97f389 от '02/12/2014'. №184 (32465.75 rur ) от 17/06/21. без ндс,0.9999980058502028,1
2021-06-17,d877722ca4e40f98,8d9e0be733f77f1c,74.0,"комиссия в другие банки (кредитные организации, банк россии) за пп/пт через дбо согласно договору рко №acc_ded93f97f389 от '02/12/2014'. документы: документ(ы):; от 17/06/21 №№: 183 (520 rur ), 182 (2960",0.9999980058502028,1
2021-06-17,d877722ca4e40f98,385844c16cc4dcb1,520.0,"за предоставление сведений, содержащихся в егрн",0.9999980058502028,1
2021-06-17,d877722ca4e40f98,7b6d655993f0d2ed,2960.0,плата за предоставление сведений из егрн,0.9999980058502028,1
2021-07-01,d877722ca4e40f98,8d9e0be733f77f1c,2500.0,плата за выдачу наличных к чеку № '798922' от '01/07/2021' согласно договору рко № acc_ded93f97f389 от '02/12/2014',0.9999980058502028,1
2021-07-01,d877722ca4e40f98,6931e23e98703aa9,1750000.0,оплата по счету № 8 от date_b42a3a2ef047 фасад наружные стены согласно договора подряда №3-тор от 19.05.17г сумма 1750000-00 в т.ч. ндс (20%) 291666-67,0.9999980058502028,1
2021-07-08,d877722ca4e40f98,6931e23e98703aa9,2290133.0,оплата по счету № 19 от date_db18f6dce3c9 устройство дождевой канализации с системой очистки cогласно договора подряда №3-тор от 19.05.17г сумма 2290133-00 в т.ч. ндс (20%) 381689-00,0.9999980058502028,1
2021-07-07,d877722ca4e40f98,4242481819cb0f02,104518.16,оплата по сч. № 013бс4070013254 от date_65ad1c2fb4ed согласно договора №013бс4070013254 от date_65ad1c2fb4ed страховой премии сумма 104518-16 без налога (ндс),0.9999980058502028,1
2021-07-07,d877722ca4e40f98,f009f83433030011,6132000.0,оплата по счету № 124/1 от 17.06.2021г оплата за постанцию трансформаторная сумма 6132000-00 в т.ч. ндс (20%) 1022000-00,0.9999980058502028,1
2021-07-07,7ad54077510c09e4,d877722ca4e40f98,350000.0,выдача займа по договору №4-си/170621 от date_8b1fbb2a73df сумма 350000-00 без налога (ндс),0.9999980058502028,1
2021-07-07,8d9e0be733f77f1c,d877722ca4e40f98,6233332.63,выдача кредита по договору n600210017 от 24 июня 2021 г. согласно распоряжения кредитного отдела n 46023008 от date_95feb18422fb. ндс нет.,0.9999980058502028,1
2021-07-08,d877722ca4e40f98,8d9e0be733f77f1c,152.0,"комиссия внутри сбербанка за пп/пт через дбо согласно договору рко № acc_ded93f97f389 от '02/12/2014'. документ(ы):; от 08/07/21 №№: 226 (26297591 rur ), 225 (1017850 rur ), 211 (1277093 rur ), 218 (108",0.9999980058502028,1
2021-07-08,d877722ca4e40f98,6931e23e98703aa9,142962.0,"оплата по счету № 18 от 30.10.2020г электромонтажные работы,устройство заземления cогласно договора подряда №3-тор от 19.05.17г сумма 142962-00 в т.ч. ндс (20%) 23827-00",0.9999980058502028,1
2021-07-08,d877722ca4e40f98,6931e23e98703aa9,207906.0,оплата по счету №6 от date_8d78158203a2 водоснабжение cогласно договора подряда №3-тор от 19.05.17г сумма 207906-00 в т.ч. ндс (20%) 34651-00,0.9999980058502028,1
2021-07-08,d877722ca4e40f98,6931e23e98703aa9,327432.0,оплата по счету №4 от date_5dc1355cd39b монтаж подьемника cогласно договора подряда №3-тор от 19.05.17г сумма 327432-00 в т.ч. ндс (20%) 54572-00,0.9999980058502028,1
2021-07-08,d877722ca4e40f98,6931e23e98703aa9,334724.0,оплата по счету №3 от date_0768de4fe23b ветиляция cогласно договора подряда №3-тор от 19.05.17г сумма 334724-00 в т.ч. ндс (20%) 55787-00,0.9999980058502028,1
2021-07-08,d877722ca4e40f98,6931e23e98703aa9,498842.0,оплата по счету № 21 от date_3f5b186e5314 ветиляция cогласно договора подряда №3-тор от 19.05.17г сумма 498842-00 в т.ч. ндс (20%) 83140-00,0.9999980058502028,1
2021-07-08,d877722ca4e40f98,6931e23e98703aa9,655135.0,оплата по счету №7 от date_bc4212c4c6e1 внутренная канализация cогласно договора подряда №3-тор от 19.05.17г сумма 655135-00 в т.ч. ндс (20%) 109189-00,0.9999980058502028,1
2021-07-08,d877722ca4e40f98,6931e23e98703aa9,767532.0,оплата по счету № 12 от 25.06.21 устройство навеса главного входа.cогласно договора подряда №3-тор от 19.05.17г сумма 767532-00 в т.ч. ндс (20%) 127922-00,0.9999980058502028,1
2021-07-08,d877722ca4e40f98,6931e23e98703aa9,1017850.0,оплата по счету №8 от 19.02.21 внутренная канализация cогласно договора подряда №3-тор от 19.05.17г сумма 1017850-00 в т.ч. ндс (20%) 169642-00,0.9999980058502028,1
2021-07-08,d877722ca4e40f98,6931e23e98703aa9,1060020.0,оплата по счету №2 от 22.01.2021г ветиляция cогласно договора подряда №3-тор от 19.05.17г сумма 1060020-00 в т.ч. ндс (20%) 176670-00,0.9999980058502028,1
2021-07-08,d877722ca4e40f98,6931e23e98703aa9,1089905.0,оплата по счету №1 от date_44aa8464dfd5 ветиляция cогласно договора подряда №3-тор от 19.05.17г сумма 1089905-00 в т.ч. ндс (20%) 181651-00,0.9999980058502028,1
2021-07-08,d877722ca4e40f98,6931e23e98703aa9,1277093.0,оплата по счету № 14 от date_7460ba5622e3 узел учета управления. сантех.монтажные работы cогласно договора подряда №3-тор от 19.05.17г сумма 1277093-00 в т.ч. ндс (20%) 212849-00,0.9999980058502028,1
2021-07-08,d877722ca4e40f98,6931e23e98703aa9,1765261.0,оплата по счету №5 от date_c0262f8e17f8 отопление cогласно договора подряда №3-тор от 19.05.17г сумма 1765261-00 в т.ч. ндс (20%) 294210-00,0.9999980058502028,1
2021-07-08,d877722ca4e40f98,6931e23e98703aa9,2239327.0,"оплата по счет-фактуре № 17 от date_933bf57856d8 отделочные работы, перегородки. cогласно договора подряда №3-тор от 19.05.17г сумма 2239327-00 в т.ч. ндс (20%) 373221-00",0.9999980058502028,1
2021-07-07,d877722ca4e40f98,8d9e0be733f77f1c,245000.0,"комиссия пао сбербанк за откр.акк. с покр. за счет к/с., с подтв. /аккредитив-8824s2107000h/rr/пп/07.07.21/245000 rur",0.9999980058502028,1
2021-07-07,d877722ca4e40f98,8d9e0be733f77f1c,39284.5,заработная плата по реестру №15 от date_95feb18422fb в соответствии с договором 50356798 от date_eb8c294d74c6,0.9999980058502028,1
2021-07-01,d877722ca4e40f98,6931e23e98703aa9,1760621.0,оплата по счету № 10 от date_aed203681a18 устройство проездов и тротуаров.отмостка. cогласно договора подряда №3-тор от 19.05.17г сумма 1760621-00 в т.ч. ндс (20%) 293436-83,0.9999980058502028,1
2021-07-07,d877722ca4e40f98,80799e1a6646b6dc,24474.61,страховые взносы на выплату страховой части трудовой пенсии,0.9999980058502028,1
2021-07-01,d877722ca4e40f98,6931e23e98703aa9,2016947.0,"оплата по счету № 11 от date_bb3d2a3e6d93 отделочные работы. полы, стены,потолки, двери, перегородки.cогласно договора подряда №3-тор от 19.05.17г сумма 2016947-00 в т.ч. ндс (20%) 336157-83",0.9999980058502028,1
2021-07-01,d877722ca4e40f98,6931e23e98703aa9,9472656.0,"оплата по счету № 9 от date_0816c1dafa53 устройство металлокаркаса.огнезащита металлоконструкций, согласно договора подряда №3-тор от 19.05.17г сумма 9472656-00 в т.ч. ндс (20%) 1578776-00",0.9999980058502028,1
2021-07-02,d877722ca4e40f98,8d9e0be733f77f1c,37.0,"комиссия в другие банки (кредитные организации, банк россии) за пп/пт через дбо согласно договору рко №acc_ded93f97f389 от '02/12/2014'. документы: №197 (1600000 rur ) от 02/07/21 без ндс",0.9999980058502028,1
2021-07-02,d877722ca4e40f98,365a9e654bc3d301,1600000.0,оплата по счету № 73 от date_63da1f80aee8 строительство теплотрассы сумма 1600000-00 без налога (ндс),0.9999980058502028,1
2021-07-03,d877722ca4e40f98,8d9e0be733f77f1c,199.0,информирование об операциях поступления и/или списания по банковскому(им) счету(ам) в рублях рф за период с '01/06/2021' по '30/06/2021'.,0.9999980058502028,1
2021-07-06,d877722ca4e40f98,8d9e0be733f77f1c,100000000.0,формирование покрытия по внутрироссийскому аккредитиву № 8824s2107000h на основании заявления № 4 от 06.07.2021г,0.9999980058502028,1
2021-07-06,8d9e0be733f77f1c,d877722ca4e40f98,100000000.0,выдача кредита по договору n600210017 от 24 июня 2021 г. согласно распоряжения кредитного отдела n 45997949 от date_f71bf3d6bd61. ндс нет.,0.9999980058502028,1
2021-07-07,d877722ca4e40f98,8d9e0be733f77f1c,8.0,комиссия внутри сбербанка за пп/пт через дбо согласно договору рко № acc_ded93f97f389 от '02/12/2014'. №199 (104518.16 rur ) от 07/07/21. без ндс,0.9999980058502028,1
2021-07-07,d877722ca4e40f98,8d9e0be733f77f1c,39.29,"комиссия за перечисление средств со сч. юл на сч.фл (в т.ч. при закрытии счета), (оборот до 150 тыс. руб) по дог. рко №acc_ded93f97f389 от '02/12/2014'. за документы: документ(ы):; от 07/07/21 №№: 205 (261",0.9999980058502028,1
2021-07-07,d877722ca4e40f98,8d9e0be733f77f1c,74.0,"комиссия в другие банки (кредитные организации, банк россии) за пп/пт через дбо согласно договору рко №acc_ded93f97f389 от '02/12/2014'. документы: документ(ы):; от 07/07/21 №№: 207 (4999.97 rur ), 198 (6",0.9999980058502028,1
2021-07-07,d877722ca4e40f98,ca3891c167141f4d,851.8,взносы на обязательное страхование от несчастных случаев. регистрационный номер в фсс inn_f24b52802750,0.9999980058502028,1
2021-07-07,d877722ca4e40f98,80799e1a6646b6dc,2483.85,взносы на обязательное социальное страхование,0.9999980058502028,1
2021-07-07,d877722ca4e40f98,035fab081fc0922f,2619.31,заработная плата за вторую половину июнь 21 г для зачисления на счет ермошкина михаила юрьевича сумма 2619-31 без налога (ндс),0.9999980058502028,1
2021-07-07,d877722ca4e40f98,917804652432403b,4999.97,оплата по исполнительный листу № № 2-7123/16 от date_178e735fd502 ермошкин м.ю. взыскателю ким натальи аркадьевны. за июнь 2021г,0.9999980058502028,1
2021-07-07,d877722ca4e40f98,6290b8d67943ece5,5238.63,заработная плата за вторую половину июнь 21г для зачисления на счет таранова константина анатольевича сумма 5238-63 без налога (ндс),0.9999980058502028,1
2021-07-07,d877722ca4e40f98,80799e1a6646b6dc,7183.96,страховые взносы на обязательное медицинское страхование,0.9999980058502028,1
2021-07-07,d877722ca4e40f98,80799e1a6646b6dc,14196.0,налог на доходы физических лиц за июнь 2021 года,0.9999980058502028,1
2021-04-05,d877722ca4e40f98,8d9e0be733f77f1c,40.91,"комиссия за перечисление средств со сч. юл на сч.фл (в т.ч. при закрытии счета), (оборот до 150 тыс. руб) по дог. рко №acc_ded93f97f389 от '02/12/2014'. за документы: документ(ы):; от 05/04/21 №№: 118 (272",0.9999980058502028,1
2021-04-05,d877722ca4e40f98,8d9e0be733f77f1c,37.0,"комиссия в другие банки (кредитные организации, банк россии) за пп/пт через дбо согласно договору рко №acc_ded93f97f389 от '02/12/2014'. документы: №117 (4999.47 rur ) от 05/04/21 без ндс",0.9999980058502028,1
2021-04-03,d877722ca4e40f98,8d9e0be733f77f1c,199.0,информирование об операциях поступления и/или списания по банковскому(им) счету(ам) в рублях рф за период с '01/03/2021' по '31/03/2021'.,0.9999980058502028,1
2021-01-21,d877722ca4e40f98,1d83fd5f5fefc19f,34469.61,оплата по договору № 3510 от date_f300508e7393 теплоэнергия за декабрь 20г доплата сумма 34469-61 в т.ч. ндс (20%) 5744-94,0.9999980058502028,1
2021-01-21,5ae9eeb0d29bc5c0,d877722ca4e40f98,100000.0,перевод денежных средств по договору № пи-1/281220 от date_8425413630fa г. сумма 100000-00 без налога (ндс),0.9999980058502028,1
2021-01-22,d877722ca4e40f98,8d9e0be733f77f1c,30.0,оплата комиссии за оказание услуг по зачислению денежных средств. за период с date_27258bb90afb по date_0d0f203d5fa5. договор от date_eb8c294d74c6 № 50356798. ндс не облагается.,0.9999980058502028,1
2021-01-22,5ae9eeb0d29bc5c0,d877722ca4e40f98,100000.0,перевод денежных средств по договору № пи-1/281220 от date_8425413630fa г. сумма 100000-00 без налога (ндс),0.9999980058502028,1
2021-01-25,d877722ca4e40f98,8d9e0be733f77f1c,37.0,"комиссия в другие банки (кредитные организации, банк россии) за пп/пт через дбо согласно договору рко №acc_ded93f97f389 от '02/12/2014'. документы: №22 (5200 rur ) от 25/01/21 без ндс",0.9999980058502028,1
2021-01-25,d877722ca4e40f98,a2495f5178d5a17d,5200.0,оплата по счету №17 от 21.01.21г погрузо-разгрузочные работы сумма 5200-00 без налога (ндс),0.9999980058502028,1
2021-01-25,5ae9eeb0d29bc5c0,d877722ca4e40f98,200000.0,перевод денежных средств по договору № пи-1/281220 от date_8425413630fa г. сумма 200000-00 без налога (ндс),0.9999980058502028,1
2021-01-26,5ae9eeb0d29bc5c0,d877722ca4e40f98,200000.0,перевод денежных средств по договору № пи-1/281220 от date_8425413630fa г. сумма 200000-00 без налога (ндс),0.9999980058502028,1
2021-01-26,7ad54077510c09e4,d877722ca4e40f98,250000.0,оплата по договору займа № 2-сф/26012021г от 26.01.2021г сумма 250000-00 без налога (ндс),0.9999980058502028,1
2021-01-27,d877722ca4e40f98,8d9e0be733f77f1c,16.0,"комиссия внутри сбербанка за пп/пт через дбо согласно договору рко № acc_ded93f97f389 от '02/12/2014'. документ(ы):; от 27/01/21 №№: 24 (602.07 rur ), 26 (200000 rur ). без ндс",0.9999980058502028,1
2021-01-27,d877722ca4e40f98,8d9e0be733f77f1c,74.0,"комиссия в другие банки (кредитные организации, банк россии) за пп/пт через дбо согласно договору рко №acc_ded93f97f389 от '02/12/2014'. документы: документ(ы):; от 27/01/21 №№: 25 (2600 rur ), 23 (100000",0.9999980058502028,1
2021-01-27,d877722ca4e40f98,a4bb2adbd377d7b6,602.07,оплата по счету №86 от 31.01.21г то тревожной сигнализации за январь 21г сумма 602-07 без налога (ндс),0.9999980058502028,1
2021-01-27,d877722ca4e40f98,8d9e0be733f77f1c,900.0,комиссия за прием наличных денежных средств через банкомат. документ(ы): №1 (300000 rur ) от 27/01/21. без ндс,0.9999980058502028,1
2021-01-27,d877722ca4e40f98,a2495f5178d5a17d,2600.0,оплата по счету №25 от 25.01.21г погрузо-разгрузочные работы сумма 2600-00 без налога (ндс),0.9999980058502028,1
2021-01-27,d877722ca4e40f98,6931e23e98703aa9,200000.0,оплата по счету № 8 от date_b42a3a2ef047 фасад наружные стеня согласно договора подряда №3-тор от 19.05.17г сумма 200000-00 в т.ч. ндс (20%) 33333-33,0.9999980058502028,1
2021-01-27,d877722ca4e40f98,f009f83433030011,1000000.0,оплата по счету № 124 от date_bea952738e70 частичная оплата за постанцию трансформаторная сумма 1000000-00 в т.ч. ндс (20%) 166666-67,0.9999980058502028,1
2021-01-27,5ae9eeb0d29bc5c0,d877722ca4e40f98,200000.0,перевод денежных средств по договору № пи-1/281220 от date_8425413630fa г. сумма 200000-00 без налога (ндс),0.9999980058502028,1
2021-01-27,8d9e0be733f77f1c,d877722ca4e40f98,300000.0,"<si>прием ден. нал. через ус 60007270 date_b959f9f486d9 00:27:59 вноситель аман вадим владимирович(170091651) 14, займы займ от учеридителя",0.9999980058502028,1
2021-01-21,d877722ca4e40f98,6931e23e98703aa9,1300000.0,оплата по счету № 8 от date_b42a3a2ef047 фасад наружные стеня согласно договора подряда №3-тор от 19.05.17г сумма 1300000-00 в т.ч. ндс (20%) 216666-67,0.9999980058502028,1
2021-01-21,d877722ca4e40f98,aab73ac39e001729,8951.0,оплата по счету № 1101 от 18.01.2021г сумма 8951-00 в т.ч. ндс (20%) 1491-83,0.9999980058502028,1
2021-01-28,d877722ca4e40f98,6931e23e98703aa9,200000.0,оплата по счету № 8 от date_b42a3a2ef047 фасад наружные стеня согласно договора подряда №3-тор от 19.05.17г сумма 200000-00 в т.ч. ндс (20%) 33333-33,0.9999980058502028,1
2021-01-21,d877722ca4e40f98,699e6f31660016bf,4500.0,оплата по счету № 56 от date_cbcc94cf5395 услуги автовышки сумма 4500-00 без налога (ндс),0.9999980058502028,1
2021-01-15,5ae9eeb0d29bc5c0,d877722ca4e40f98,300000.0,перевод денежных средств по договору № пи-1/281220 от date_8425413630fa г. сумма 300000-00 без налога (ндс),0.9999980058502028,1
2021-01-18,d877722ca4e40f98,8d9e0be733f77f1c,8.0,комиссия внутри сбербанка за пп/пт через дбо согласно договору рко № acc_ded93f97f389 от '02/12/2014'. №11 (1000000 rur ) от 18/01/21. без ндс,0.9999980058502028,1
2021-01-18,d877722ca4e40f98,8d9e0be733f77f1c,111.0,"комиссия в другие банки (кредитные организации, банк россии) за пп/пт через дбо согласно договору рко №acc_ded93f97f389 от '02/12/2014'. документы: документ(ы):; от 18/01/21 №№: 12 (13500 rur ), 13 (10000",0.9999980058502028,1
2021-01-18,d877722ca4e40f98,813f62b60a645969,10000.0,оплата по счету № 14 от date_d7e856e07657 транспортные услуги сумма 10000-00 без налога (ндс),0.9999980058502028,1
2021-01-18,d877722ca4e40f98,ed18d013d231f2d0,13500.0,оплата по счету № 6 от date_d7e856e07657 услуги крана сумма 13500-00 без налога (ндс),0.9999980058502028,1
2021-01-18,d877722ca4e40f98,2b652fbf87f8d72b,13600.0,оплата по счету № 50 от 18.01.2021г тех обслуживание пожарного гидранта сумма 13600-00 без налога (ндс),0.9999980058502028,1
2021-01-18,d877722ca4e40f98,6931e23e98703aa9,1000000.0,оплата по счету № 8 от date_b42a3a2ef047 фасад наружные стеня согласно договора подряда №3-тор от 19.05.17г сумма 1000000-00 в т.ч. ндс (20%) 166666-67,0.9999980058502028,1
2021-01-18,c1ad1d5de1335233,d877722ca4e40f98,80000.0,оплата по договору займа № 9-би/18012021 сумма 80000-00 без налога (ндс),0.9999980058502028,1
2021-01-18,5ae9eeb0d29bc5c0,d877722ca4e40f98,1000000.0,перевод денежных средств по договору № пи-1/281220 от date_8425413630fa г. сумма 1000000-00 без налога (ндс),0.9999980058502028,1
2021-01-19,5ae9eeb0d29bc5c0,d877722ca4e40f98,1250000.0,перевод денежных средств по договору № пи-1/281220 от date_8425413630fa г. сумма 1250000-00 без налога (ндс),0.9999980058502028,1
2021-01-20,d877722ca4e40f98,8d9e0be733f77f1c,25.0,"комиссия за перечисление средств со сч. юл на сч.фл (в т.ч. при закрытии счета), (оборот до 150 тыс. руб) по дог. рко №acc_ded93f97f389 от '02/12/2014'. за документы: документ(ы):; от 20/01/21 №№: 15 (1666",0.9999980058502028,1
2021-01-20,d877722ca4e40f98,035fab081fc0922f,1666.65,заработная плата за первую половину января 21 г для зачисления на счет ермошкина михаила юрьевича сумма 1666-65 без налога (ндс),0.9999980058502028,1
2021-01-20,d877722ca4e40f98,6290b8d67943ece5,3333.31,заработная плата за первую половину января 21г для зачисления на счет таранова константина анатольевича сумма 3333-31 без налога (ндс),0.9999980058502028,1
2021-01-20,d877722ca4e40f98,8d9e0be733f77f1c,14999.99,аванс по заработной плате по реестру №1 от date_ec3f732850b0 в соответствии с договором 50356798 от date_eb8c294d74c6,0.9999980058502028,1
2021-01-21,d877722ca4e40f98,8d9e0be733f77f1c,24.0,"комиссия внутри сбербанка за пп/пт через дбо согласно договору рко № acc_ded93f97f389 от '02/12/2014'. документ(ы):; от 21/01/21 №№: 19 (4500 rur ), 20 (8951 rur ), 21 (1300000 rur ). без ндс",0.9999980058502028,1
2021-01-21,d877722ca4e40f98,8d9e0be733f77f1c,74.0,"комиссия в другие банки (кредитные организации, банк россии) за пп/пт через дбо согласно договору рко №acc_ded93f97f389 от '02/12/2014'. документы: документ(ы):; от 21/01/21 №№: 17 (34469.61 rur ), 18 (30",0.9999980058502028,1
2021-01-21,d877722ca4e40f98,ac31ae518119510a,3000.0,оплата по счету № 51981 от 25.01.21г за февраль 21г сумма 3000-00 без налога (ндс),0.9999980058502028,1
2021-01-28,d877722ca4e40f98,8d9e0be733f77f1c,8.0,комиссия внутри сбербанка за пп/пт через дбо согласно договору рко № acc_ded93f97f389 от '02/12/2014'. №27 (200000 rur ) от 28/01/21. без ндс,0.9999980058502028,1
2021-01-28,5ae9eeb0d29bc5c0,d877722ca4e40f98,200000.0,перевод денежных средств по договору № пи-1/281220 от date_8425413630fa г. сумма 200000-00 без налога (ндс),0.9999980058502028,1
2021-01-15,d877722ca4e40f98,8d9e0be733f77f1c,8.0,комиссия внутри сбербанка за пп/пт через дбо согласно договору рко № acc_ded93f97f389 от '02/12/2014'. №10 (300000 rur ) от 15/01/21. без ндс,0.9999980058502028,1
2021-02-05,d877722ca4e40f98,8d9e0be733f77f1c,37.0,"комиссия в другие банки (кредитные организации, банк россии) за пп/пт через дбо согласно договору рко №acc_ded93f97f389 от '02/12/2014'. документы: №42 (4999.97 rur ) от 05/02/21 без ндс",0.9999980058502028,1
2021-02-05,d877722ca4e40f98,ca3891c167141f4d,531.02,взносы на обязательное страхование от несчастных случаев. регистрационный номер в фсс inn_f24b52802750,0.9999980058502028,1
2021-02-05,d877722ca4e40f98,80799e1a6646b6dc,2112.87,взносы на обязательное социальное страхование,0.9999980058502028,1
2021-02-05,d877722ca4e40f98,035fab081fc0922f,3333.31,заработная плата за вторую половину января 21 г для зачисления на счет ермошкина михаила юрьевича сумма 3333-31 без налога (ндс),0.9999980058502028,1
2021-02-05,d877722ca4e40f98,80799e1a6646b6dc,4498.04,страховые взносы на обязательное медицинское страхование,0.9999980058502028,1
2021-02-05,d877722ca4e40f98,917804652432403b,4999.97,оплата по исполнительный листу № № 2-7123/16 от date_178e735fd502 ермошкин м.ю. взыскателю ким натальи аркадьевны. за январь 2021г,0.9999980058502028,1
2021-02-05,d877722ca4e40f98,6290b8d67943ece5,6666.62,заработная плата за вторую половину января 21г для зачисления на счет таранова константина анатольевича сумма 6666-62 без налога (ндс),0.9999980058502028,1
2021-02-05,d877722ca4e40f98,80799e1a6646b6dc,11504.0,налог на доходы физических лиц за январь 2021 года,0.9999980058502028,1
2021-02-05,d877722ca4e40f98,80799e1a6646b6dc,17593.3,страховые взносы на выплату страховой части трудовой пенсии,0.9999980058502028,1
2021-02-05,d877722ca4e40f98,8d9e0be733f77f1c,29999.95,заработная плата по реестру №2 от date_5dc1355cd39b в соответствии с договором 50356798 от date_eb8c294d74c6,0.9999980058502028,1
2021-02-05,d877722ca4e40f98,6931e23e98703aa9,200000.0,оплата по счету № 8 от date_b42a3a2ef047 фасад наружные стены согласно договора подряда №3-тор от 19.05.17г сумма 200000-00 в т.ч. ндс (20%) 33333-33,0.9999980058502028,1
2021-02-05,d877722ca4e40f98,6931e23e98703aa9,200000.0,оплата по счету № 8 от date_b42a3a2ef047 фасад наружные стены согласно договора подряда №3-тор от 19.05.17г сумма 200000-00 в т.ч. ндс (20%) 33333-33,0.9999980058502028,1
2021-02-05,7ad54077510c09e4,d877722ca4e40f98,100000.0,оплата по договору займа № 2-сф/26012021г от 26.01.2021г сумма 100000-00 без налога (ндс),0.9999980058502028,1
2021-02-05,5ae9eeb0d29bc5c0,d877722ca4e40f98,200000.0,перевод денежных средств по договору № пи-1/281220 от date_8425413630fa г. сумма 200000-00 без налога (ндс),0.9999980058502028,1
2021-02-08,d877722ca4e40f98,8d9e0be733f77f1c,8.0,комиссия внутри сбербанка за пп/пт через дбо согласно договору рко № acc_ded93f97f389 от '02/12/2014'. №45 (200000 rur ) от 08/02/21. без ндс,0.9999980058502028,1
2021-02-08,d877722ca4e40f98,8d9e0be733f77f1c,37.0,"комиссия в другие банки (кредитные организации, банк россии) за пп/пт через дбо согласно договору рко №acc_ded93f97f389 от '02/12/2014'. документы: №44 (16900 rur ) от 08/02/21 без ндс",0.9999980058502028,1
2021-02-08,d877722ca4e40f98,a2495f5178d5a17d,16900.0,оплата по счету №38 от 04.02.21г погрузо-разгрузочные работы сумма 16900-00 без налога (ндс),0.9999980058502028,1
2021-02-08,d877722ca4e40f98,6931e23e98703aa9,200000.0,оплата по счету № 8 от date_b42a3a2ef047 фасад наружные стены согласно договора подряда №3-тор от 19.05.17г сумма 200000-00 в т.ч. ндс (20%) 33333-33,0.9999980058502028,1
2021-02-05,d877722ca4e40f98,8d9e0be733f77f1c,50.0,"комиссия за перечисление средств со сч. юл на сч.фл (в т.ч. при закрытии счета), (оборот до 150 тыс. руб) по дог. рко №acc_ded93f97f389 от '02/12/2014'. за документы: документ(ы):; от 05/02/21 №№: 41 (6666",0.9999980058502028,1
2021-02-05,d877722ca4e40f98,8d9e0be733f77f1c,16.0,"комиссия внутри сбербанка за пп/пт через дбо согласно договору рко № acc_ded93f97f389 от '02/12/2014'. документ(ы):; от 05/02/21 №№: 43 (200000 rur ), 34 (200000 rur ). без ндс",0.9999980058502028,1
2021-01-29,d877722ca4e40f98,8d9e0be733f77f1c,16.0,"комиссия внутри сбербанка за пп/пт через дбо согласно договору рко № acc_ded93f97f389 от '02/12/2014'. документ(ы):; от 29/01/21 №№: 28 (200000 rur ), 29 (84935 rur ). без ндс",0.9999980058502028,1
2021-02-04,5ae9eeb0d29bc5c0,d877722ca4e40f98,200000.0,перевод денежных средств по договору № пи-1/281220 от date_8425413630fa г. сумма 200000-00 без налога (ндс),0.9999980058502028,1
2021-01-29,d877722ca4e40f98,032f0b4d2498f263,84935.0,оплата процентов по договору процентного денежного займа №1 от 17.12.20г сумма 84935-00 без налога (ндс),0.9999980058502028,1
2021-01-29,d877722ca4e40f98,6931e23e98703aa9,200000.0,оплата по счету № 8 от date_b42a3a2ef047 фасад наружные стены согласно договора подряда №3-тор от 19.05.17г сумма 200000-00 в т.ч. ндс (20%) 33333-33,0.9999980058502028,1
2021-01-29,41face6c4b94dd88,d877722ca4e40f98,6336.0,оплата по счету № 1 от 25.01.2021г. штраф сумма 6336-00 без налога (ндс),0.9999980058502028,1
2021-01-29,5ae9eeb0d29bc5c0,d877722ca4e40f98,200000.0,перевод денежных средств по договору № пи-1/281220 от date_8425413630fa г. сумма 200000-00 без налога (ндс),0.9999980058502028,1
2021-02-01,d877722ca4e40f98,8d9e0be733f77f1c,8.0,комиссия внутри сбербанка за пп/пт через дбо согласно договору рко № acc_ded93f97f389 от '02/12/2014'. №30 (200000 rur ) от 01/02/21. без ндс,0.9999980058502028,1
2021-02-01,d877722ca4e40f98,8d9e0be733f77f1c,1800.0,комиссия за ведение счета 'acc_ded93f97f389' от '02/12/2014' за период с '01/01/2021' по '31/01/2021' за 31 дней. ндс не облагается,0.9999980058502028,1
2021-02-01,d877722ca4e40f98,6931e23e98703aa9,200000.0,оплата по счету № 8 от date_b42a3a2ef047 фасад наружные стены согласно договора подряда №3-тор от 19.05.17г сумма 200000-00 в т.ч. ндс (20%) 33333-33,0.9999980058502028,1
2021-02-01,5ae9eeb0d29bc5c0,d877722ca4e40f98,200000.0,перевод денежных средств по договору № пи-1/281220 от date_8425413630fa г. сумма 200000-00 без налога (ндс),0.9999980058502028,1
2021-02-02,d877722ca4e40f98,8d9e0be733f77f1c,8.0,комиссия внутри сбербанка за пп/пт через дбо согласно договору рко № acc_ded93f97f389 от '02/12/2014'. №31 (200000 rur ) от 02/02/21. без ндс,0.9999980058502028,1
2021-02-02,d877722ca4e40f98,6931e23e98703aa9,200000.0,оплата по счету № 8 от date_b42a3a2ef047 фасад наружные стены согласно договора подряда №3-тор от 19.05.17г сумма 200000-00 в т.ч. ндс (20%) 33333-33,0.9999980058502028,1
2021-02-02,5ae9eeb0d29bc5c0,d877722ca4e40f98,200000.0,перевод денежных средств по договору № пи-1/281220 от date_8425413630fa г. сумма 200000-00 без налога (ндс),0.9999980058502028,1
2021-02-03,d877722ca4e40f98,8d9e0be733f77f1c,8.0,комиссия внутри сбербанка за пп/пт через дбо согласно договору рко № acc_ded93f97f389 от '02/12/2014'. №32 (200000 rur ) от 03/02/21. без ндс,0.9999980058502028,1
2021-02-03,d877722ca4e40f98,8d9e0be733f77f1c,37.0,"комиссия в другие банки (кредитные организации, банк россии) за пп/пт через дбо согласно договору рко №acc_ded93f97f389 от '02/12/2014'. документы: №33 (1800 rur ) от 03/02/21 без ндс",0.9999980058502028,1
2021-02-03,d877722ca4e40f98,8d9e0be733f77f1c,199.0,информирование об операциях поступления и/или списания по банковскому(им) счету(ам) в рублях рф за период с '01/01/2021' по '31/01/2021'.,0.9999980058502028,1
2021-02-03,d877722ca4e40f98,ed18d013d231f2d0,1800.0,оплата по счету № 13 от date_0d0f203d5fa5 транспортные услуги сумма 1800-00 без налога (ндс),0.9999980058502028,1
2021-02-03,d877722ca4e40f98,6931e23e98703aa9,200000.0,оплата по счету № 8 от date_b42a3a2ef047 фасад наружные стены согласно договора подряда №3-тор от 19.05.17г сумма 200000-00 в т.ч. ндс (20%) 33333-33,0.9999980058502028,1
2021-02-03,5ae9eeb0d29bc5c0,d877722ca4e40f98,200000.0,перевод денежных средств по договору № пи-1/281220 от date_8425413630fa г. сумма 200000-00 без налога (ндс),0.9999980058502028,1
2021-01-15,d877722ca4e40f98,6931e23e98703aa9,300000.0,оплата по счету № 8 от date_b42a3a2ef047 фасад наружные стеня согласно договора подряда №3-тор от 19.05.17г сумма 300000-00 в т.ч. ндс (20%) 50000-00,0.9999980058502028,1
2021-01-14,5ae9eeb0d29bc5c0,d877722ca4e40f98,300000.0,перевод денежных средств по договору № пи-1/281220 от date_8425413630fa г. сумма 300000-00 без налога (ндс),0.9999980058502028,1
2021-02-09,d877722ca4e40f98,8d9e0be733f77f1c,8.0,комиссия внутри сбербанка за пп/пт через дбо согласно договору рко № acc_ded93f97f389 от '02/12/2014'. №46 (200000 rur ) от 09/02/21. без ндс,0.9999980058502028,1
2020-12-22,d877722ca4e40f98,8d9e0be733f77f1c,24.0,"комиссия внутри сбербанка за пп/пт через дбо согласно договору рко № acc_ded93f97f389 от '02/12/2014'. документ(ы):; от 22/12/20 №№: 370 (100499 rur ), 371 (480000 rur ), 372 (2000000 rur ). без ндс",0.9999980058502028,1
2020-12-22,d877722ca4e40f98,c1ad1d5de1335233,480000.0,частичный возврат займа по договору №1-би/09022017 от date_4c99f7c44a6c сумма 480000-00 без налога (ндс),0.9999980058502028,1
2020-12-22,d877722ca4e40f98,6931e23e98703aa9,2000000.0,оплата по счету № 8 от date_b42a3a2ef047 сумма 2000000-00 в т.ч. ндс (20%) 333333-33,0.9999980058502028,1
2020-12-22,659207c64fee1c66,d877722ca4e40f98,100000.0,перевод денежных средств по договору № ки-1/110620 от 11.06.2020г. сумма 100000-00 без налога (ндс),0.9999980058502028,1
2020-12-22,80799e1a6646b6dc,d877722ca4e40f98,3131088.0,"acc_cd27e0d43c60;ст. 176 нк рф, год: 2020 решение n 301173 от date_43f2f1b3167e наименование: ооо ""инкриз"", инн: inn_d877722ca4e4, кпп: 650101001 наименование но: межрайонная инспекция федеральной налоговой службы n 1 п",0.9999980058502028,1
2020-12-23,d877722ca4e40f98,8d9e0be733f77f1c,8.0,комиссия внутри сбербанка за пп/пт через дбо согласно договору рко № acc_ded93f97f389 от '02/12/2014'. №373 (100000 rur ) от 23/12/20. без ндс,0.9999980058502028,1
2020-12-23,d877722ca4e40f98,6931e23e98703aa9,100000.0,оплата по счету № 8 от date_b42a3a2ef047 фасад наружные стеня согласно договора подряда №3-тор от 19.05.17г сумма 100000-00 в т.ч. ндс (20%) 16666-67,0.9999980058502028,1
2020-12-23,41face6c4b94dd88,d877722ca4e40f98,6336.0,оплата по счету № 4 от 22.12.2020г. штраф сумма 6336-00 без налога (ндс),0.9999980058502028,1
2020-12-23,659207c64fee1c66,d877722ca4e40f98,100000.0,перевод денежных средств по договору № ки-1/110620 от 11.06.2020г. сумма 100000-00 без налога (ндс),0.9999980058502028,1
2020-12-24,d877722ca4e40f98,8d9e0be733f77f1c,8.0,комиссия внутри сбербанка за пп/пт через дбо согласно договору рко № acc_ded93f97f389 от '02/12/2014'. №374 (100000 rur ) от 24/12/20. без ндс,0.9999980058502028,1
2020-12-24,d877722ca4e40f98,6931e23e98703aa9,100000.0,оплата по счету № 8 от date_b42a3a2ef047 фасад наружные стеня согласно договора подряда №3-тор от 19.05.17г сумма 100000-00 в т.ч. ндс (20%) 16666-67,0.9999980058502028,1
2020-12-24,659207c64fee1c66,d877722ca4e40f98,100000.0,перевод денежных средств по договору № ки-1/110620 от 11.06.2020г. сумма 100000-00 без налога (ндс),0.9999980058502028,1
2020-12-25,d877722ca4e40f98,8d9e0be733f77f1c,16.0,"комиссия внутри сбербанка за пп/пт через дбо согласно договору рко № acc_ded93f97f389 от '02/12/2014'. документ(ы):; от 25/12/20 №№: 375 (100000 rur ), 377 (7000 rur ). без ндс",0.9999980058502028,1
2020-12-25,d877722ca4e40f98,8d9e0be733f77f1c,37.0,"комиссия в другие банки (кредитные организации, банк россии) за пп/пт через дбо согласно договору рко №acc_ded93f97f389 от '02/12/2014'. документы: №376 (15000 rur ) от 25/12/20 без ндс",0.9999980058502028,1
2020-12-25,d877722ca4e40f98,14f253ce33aac781,7000.0,оплата по счету № 281 от 25.12.20 пошив чехла на снегоротор сумма 7000-00 без налога (ндс),0.9999980058502028,1
2020-12-25,d877722ca4e40f98,93712c726144e60d,15000.0,оплата по счету №34 от 24.12.20г ремонт снегоротора сумма 15000-00 без налога (ндс),0.9999980058502028,1
2020-12-25,d877722ca4e40f98,6931e23e98703aa9,100000.0,оплата по счету № 8 от date_b42a3a2ef047 фасад наружные стеня согласно договора подряда №3-тор от 19.05.17г сумма 100000-00 в т.ч. ндс (20%) 16666-67,0.9999980058502028,1
2020-12-25,659207c64fee1c66,d877722ca4e40f98,100000.0,перевод денежных средств по договору № ки-1/110620 от 11.06.2020г. сумма 100000-00 без налога (ндс),0.9999980058502028,1
2020-12-22,d877722ca4e40f98,6931e23e98703aa9,100499.0,оплата по счету № 8 от date_b42a3a2ef047 фасад наружные стены согласно договора подряда №3-тор от 19.05.17г сумма 100499-00 в т.ч. ндс (20%) 16749-83,0.9999980058502028,1
2020-12-21,659207c64fee1c66,d877722ca4e40f98,100000.0,перевод денежных средств по договору № ки-1/110620 от 11.06.2020г. сумма 100000-00 без налога (ндс),0.9999980058502028,1
2020-12-28,d877722ca4e40f98,032f0b4d2498f263,35519.0,оплата процентов по договору процентного денежного займа №1 от 17.12.20г сумма 35519-00 без налога (ндс),0.9999980058502028,1
2020-12-21,d877722ca4e40f98,6931e23e98703aa9,3000000.0,оплата по счету № 7 от date_0abafb076672 устройство кровли согласно договора подряда №3-тор от 19.05.2017г сумма 3000000-00 в т.ч. ндс (20%) 500000-00,0.9999980058502028,1
2020-12-18,d877722ca4e40f98,8d9e0be733f77f1c,21520.06,аванс по заработной плате по реестру №10 от date_43f2f1b3167e в соответствии с договором 50356798 от date_eb8c294d74c6,0.9999980058502028,1
2020-12-18,d877722ca4e40f98,6931e23e98703aa9,100000.0,оплата по счету № 7 от date_0abafb076672 устройство кровли согласно договора подряда №3-тор от 19.05.2017г сумма 100000-00 в т.ч. ндс (20%) 16666-67,0.9999980058502028,1
2020-12-18,659207c64fee1c66,d877722ca4e40f98,100000.0,перевод денежных средств по договору № ки-1/110620 от 11.06.2020г. сумма 100000-00 без налога (ндс),0.9999980058502028,1
2020-12-19,032f0b4d2498f263,d877722ca4e40f98,10000000.0,выдача займа по договору займа № 1 от 17.12.2020г 10000000-00 р. без налога (ндс),0.9999980058502028,1
2020-12-21,d877722ca4e40f98,8d9e0be733f77f1c,43.04,оплата комиссии за оказание услуг по зачислению денежных средств. за период с date_03954b8c16af по date_cabc05968277. договор от date_eb8c294d74c6 № 50356798. ндс не облагается.,0.9999980058502028,1
2020-12-21,d877722ca4e40f98,8d9e0be733f77f1c,64.0,"комиссия внутри сбербанка за пп/пт через дбо согласно договору рко № acc_ded93f97f389 от '02/12/2014'. документ(ы):; от 21/12/20 №№: 359 (3000000 rur ), 360 (500000 rur ), 363 (1090000 rur ), 369 (10000",0.9999980058502028,1
2020-12-21,d877722ca4e40f98,8d9e0be733f77f1c,111.0,"комиссия в другие банки (кредитные организации, банк россии) за пп/пт через дбо согласно договору рко №acc_ded93f97f389 от '02/12/2014'. документы: документ(ы):; от 21/12/20 №№: 368 (158620.67 rur ), 364",0.9999980058502028,1
2020-12-21,d877722ca4e40f98,eed8b1f54ed4366c,13689.08,оплата по договору 27465 технолог.присоединение сумма 13689-08 в т.ч. ндс (20%) 2281-51,0.9999980058502028,1
2020-12-21,d877722ca4e40f98,85ee5df9d37a27a6,23642.0,оплата по сч.№ 7 от 05.04.19 авторский надзор по договору № 7 от 20.12.16г за холодсервис сумма 23642-00 без налога (ндс),0.9999980058502028,1
2020-12-21,d877722ca4e40f98,85ee5df9d37a27a6,76358.0,оплата по сч.№ 6 от 28.02.2019г авторский надзор по договору № 7 от 20.12.16г за холодсервис сумма 76358-00 без налога (ндс),0.9999980058502028,1
2020-12-21,d877722ca4e40f98,6931e23e98703aa9,100000.0,оплата по счету № 8 от date_b42a3a2ef047 фасад наружные стеня согласно договора подряда №3-тор от 19.05.17г сумма 100000-00 в т.ч. ндс (20%) 16666-67,0.9999980058502028,1
2020-12-21,d877722ca4e40f98,1d83fd5f5fefc19f,158620.67,оплата по договору № 3510 от date_f300508e7393 теплоэнергия аванс за декабрь 20г сумма 158620-67 в т.ч. ндс (20%) 26436-78,0.9999980058502028,1
2020-12-21,d877722ca4e40f98,f0be9c0037548bf2,500000.0,оплата по счету № 6304 от date_43f2f1b3167e монтаж и наладка пожарной сигнализации по дог.№120/20 от 18.12.20 сумма 500000-00 без налога (ндс),0.9999980058502028,1
2020-12-21,d877722ca4e40f98,f009f83433030011,1000000.0,оплата по счету № 124 от date_bea952738e70 частичная оплата за постанцию трансформаторная сумма 1000000-00 в т.ч. ндс (20%) 166666-67,0.9999980058502028,1
2020-12-21,d877722ca4e40f98,6931e23e98703aa9,1090000.0,оплата по счету № 8 от date_b42a3a2ef047 фасад наружные стеня согласно договора подряда №3-тор от 19.05.17г сумма 1090000-00 в т.ч. ндс (20%) 181666-67,0.9999980058502028,1
2020-12-21,d877722ca4e40f98,6931e23e98703aa9,1910000.0,оплата по счету № 7 от date_0abafb076672 устройство кровли согласно договора подряда №3-тор от 19.05.2017г сумма 1910000-00 в т.ч. ндс (20%) 318333-33,0.9999980058502028,1
2020-12-21,d877722ca4e40f98,1d83fd5f5fefc19f,2189587.9,оплата по договору 02-скк/тп/17 от date_88bd5426f2c8 теплоснабжение сумма 2189587-90 в т.ч. ндс (20%) 364931-32,0.9999980058502028,1
2020-12-28,d877722ca4e40f98,8d9e0be733f77f1c,16.0,"комиссия внутри сбербанка за пп/пт через дбо согласно договору рко № acc_ded93f97f389 от '02/12/2014'. документ(ы):; от 28/12/20 №№: 378 (35519 rur ), 379 (100000 rur ). без ндс",0.9999980058502028,1
2020-12-28,d877722ca4e40f98,6931e23e98703aa9,100000.0,оплата по счету № 8 от date_b42a3a2ef047 фасад наружные стеня согласно договора подряда №3-тор от 19.05.17г сумма 100000-00 в т.ч. ндс (20%) 16666-67,0.9999980058502028,1
2021-01-14,d877722ca4e40f98,6931e23e98703aa9,300000.0,оплата по счету № 8 от date_b42a3a2ef047 фасад наружные стеня согласно договора подряда №3-тор от 19.05.17г сумма 300000-00 в т.ч. ндс (20%) 50000-00,0.9999980058502028,1
2020-12-31,d877722ca4e40f98,8d9e0be733f77f1c,1800.0,комиссия за ведение счета 'acc_ded93f97f389' от '02/12/2014' за период с '01/12/2020' по '31/12/2020' за 31 дней. ндс не облагается,0.9999980058502028,1
2021-01-11,d877722ca4e40f98,eed8b1f54ed4366c,17262.0,оплата по договору электроэнергия по дог.№112458 от 03.03.17 аванс 70 % за январь 2021г по с/ф 44217-080-02 от 31.12.20г сумма 17262-00 в т.ч. ндс (20%) 2877-00,0.9999980058502028,1
2021-01-11,d877722ca4e40f98,6d806e49c5774c77,80000.0,оплата по договору №29-12/2020 сумма 80000-00 без налога (ндс),0.9999980058502028,1
2021-01-11,5ae9eeb0d29bc5c0,d877722ca4e40f98,200000.0,перевод денежных средств по договору № пи-1/281220 от date_8425413630fa г. сумма 200000-00 без налога (ндс),0.9999980058502028,1
2021-01-12,d877722ca4e40f98,8d9e0be733f77f1c,16.0,"комиссия внутри сбербанка за пп/пт через дбо согласно договору рко № acc_ded93f97f389 от '02/12/2014'. документ(ы):; от 12/01/21 №№: 3 (200000 rur ), 4 (200000 rur ). без ндс",0.9999980058502028,1
2021-01-12,d877722ca4e40f98,8d9e0be733f77f1c,199.0,информирование об операциях поступления и/или списания по банковскому(им) счету(ам) в рублях рф за период с '01/12/2020' по '31/12/2020'.,0.9999980058502028,1
2021-01-12,d877722ca4e40f98,6931e23e98703aa9,200000.0,оплата по счету № 8 от date_b42a3a2ef047 фасад наружные стеня согласно договора подряда №3-тор от 19.05.17г сумма 200000-00 в т.ч. ндс (20%) 33333-33,0.9999980058502028,1
2021-01-12,d877722ca4e40f98,6931e23e98703aa9,200000.0,оплата по счету № 8 от date_b42a3a2ef047 фасад наружные стеня согласно договора подряда №3-тор от 19.05.17г сумма 200000-00 в т.ч. ндс (20%) 33333-33,0.9999980058502028,1
2021-01-12,5ae9eeb0d29bc5c0,d877722ca4e40f98,200000.0,перевод денежных средств по договору № пи-1/281220 от date_8425413630fa г. сумма 200000-00 без налога (ндс),0.9999980058502028,1
2021-01-13,d877722ca4e40f98,8d9e0be733f77f1c,16.0,"комиссия внутри сбербанка за пп/пт через дбо согласно договору рко № acc_ded93f97f389 от '02/12/2014'. документ(ы):; от 13/01/21 №№: 5 (327360 rur ), 7 (300000 rur ). без ндс",0.9999980058502028,1
2021-01-13,d877722ca4e40f98,8d9e0be733f77f1c,37.0,"комиссия в другие банки (кредитные организации, банк россии) за пп/пт через дбо согласно договору рко №acc_ded93f97f389 от '02/12/2014'. документы: №6 (16900 rur ) от 13/01/21 без ндс",0.9999980058502028,1
2021-01-13,d877722ca4e40f98,a2495f5178d5a17d,16900.0,оплата по счету № 4 от 12.01.21г погрузо-разгрузочные работы сумма 16900-00 без налога (ндс),0.9999980058502028,1
2021-01-13,d877722ca4e40f98,6931e23e98703aa9,300000.0,оплата по счету № 8 от date_b42a3a2ef047 фасад наружные стеня согласно договора подряда №3-тор от 19.05.17г сумма 300000-00 в т.ч. ндс (20%) 50000-00,0.9999980058502028,1
2021-01-13,d877722ca4e40f98,41face6c4b94dd88,327360.0,оплата по счету № 408 от date_5d91dd804d5e услуги физической охраны за декабрь 20г сумма 327360-00 без налога (ндс),0.9999980058502028,1
2021-01-13,5ae9eeb0d29bc5c0,d877722ca4e40f98,300000.0,перевод денежных средств по договору № пи-1/281220 от date_8425413630fa г. сумма 300000-00 без налога (ндс),0.9999980058502028,1
2021-01-14,d877722ca4e40f98,8d9e0be733f77f1c,8.0,комиссия внутри сбербанка за пп/пт через дбо согласно договору рко № acc_ded93f97f389 от '02/12/2014'. №9 (300000 rur ) от 14/01/21. без ндс,0.9999980058502028,1
2021-01-14,d877722ca4e40f98,8d9e0be733f77f1c,37.0,"комиссия в другие банки (кредитные организации, банк россии) за пп/пт через дбо согласно договору рко №acc_ded93f97f389 от '02/12/2014'. документы: №8 (21780 rur ) от 14/01/21 без ндс",0.9999980058502028,1
2021-01-14,d877722ca4e40f98,767c3f5f72b4494f,21780.0,оплата по счету № 154 от 13.01.21г за огнетушители сумма 21780-00 в т.ч. ндс (20%) 3630-00,0.9999980058502028,1
2021-01-11,d877722ca4e40f98,8d9e0be733f77f1c,16.0,"комиссия внутри сбербанка за пп/пт через дбо согласно договору рко № acc_ded93f97f389 от '02/12/2014'. документ(ы):; от 11/01/21 №№: 1 (80000 rur ), 2 (17262 rur ). без ндс",0.9999980058502028,1
2020-12-31,d877722ca4e40f98,8d9e0be733f77f1c,46.96,оплата комиссии за оказание услуг по зачислению денежных средств. за период с date_f300508e7393 по date_2a5f75c8ae9f. договор от date_eb8c294d74c6 № 50356798. ндс не облагается.,0.9999980058502028,1
2020-12-28,5ae9eeb0d29bc5c0,d877722ca4e40f98,100000.0,перевод денежных средств по договору № пи-1/281220 от date_8425413630fa г. сумма 100000-00 без налога (ндс),0.9999980058502028,1
2020-12-30,5ae9eeb0d29bc5c0,d877722ca4e40f98,200000.0,перевод денежных средств по договору № пи-1/281220 от date_8425413630fa г. сумма 200000-00 без налога (ндс),0.9999980058502028,1
2020-12-29,d877722ca4e40f98,8d9e0be733f77f1c,16.0,"комиссия внутри сбербанка за пп/пт через дбо согласно договору рко № acc_ded93f97f389 от '02/12/2014'. документ(ы):; от 29/12/20 №№: 380 (79460 rur ), 381 (200000 rur ). без ндс",0.9999980058502028,1
